title,doctor_url,specialization,kraj,okres
"Všeobecná ambulancia pre dospelých, Heľpa, (Merci n.o.)",https://www.e-vuc.sk/bbsk/zdravotnictvo/ambulantne-zdravotnicke-zariadenia/brezno/vseobecna-ambulancia-pre-dospelych-helpa-merci-n.o.-1.html?page_id=143486, Všeobecné lekárstvo,Banskobystricky,Brezno
"Všeobecná ambulancia pre dospelých, Pohorelá, (Merci n.o.)",https://www.e-vuc.sk/bbsk/zdravotnictvo/ambulantne-zdravotnicke-zariadenia/brezno/vseobecna-ambulancia-pre-dospelych-pohorela-merci-n.o.-1.html?page_id=143487, Všeobecné lekárstvo,Banskobystricky,Brezno
"Ambulancia zubného lekárstva,  MDDr. Kristína Kováčiková, Čierny Balog, (KK-Dental s. r. o.)",https://www.e-vuc.sk/bbsk/zdravotnictvo/ambulantne-zdravotnicke-zariadenia/brezno/ambulancia-zubneho-lekarstva-mddr.-kristina-kovacikova-cierny-balog-kk-dental-s.-r.-o..html?page_id=142383, Zubné lekárstvo,Banskobystricky,Brezno
"ADOS, Pionierska, Brezno, (ZDRAVÍ DOMA n.o.)",https://www.e-vuc.sk/bbsk/zdravotnictvo/ambulantne-zdravotnicke-zariadenia/brezno/ados-pionierska-brezno-zdravi-doma-n.o..html?page_id=142187, Domáca ošetrovateľská starostlivosť,Banskobystricky,Brezno
"SVaLZ, rádiológia, Brezno, (Diagnostic net, s.r.o.)",https://www.e-vuc.sk/bbsk/zdravotnictvo/ambulantne-zdravotnicke-zariadenia/brezno/svalz-radiologia-brezno-diagnostic-net.html?page_id=142176, Rádiológia,Banskobystricky,Brezno
"ADOS, Hlavná, Pohronská Polhora, (Mgr. Janka Tyčiaková)",https://www.e-vuc.sk/bbsk/zdravotnictvo/ambulantne-zdravotnicke-zariadenia/brezno/ados-hlavna-pohronska-polhora-mgr.-janka-tyciakova.html?page_id=141539, Domáca ošetrovateľská starostlivosť,Banskobystricky,Brezno
"Všeobecná ambulancia pre dospelých, Šumiac, (Medical Help s.r.o.)",https://www.e-vuc.sk/bbsk/zdravotnictvo/ambulantne-zdravotnicke-zariadenia/brezno/vseobecna-ambulancia-pre-dospelych-sumiac-medical-help.html?page_id=141322, Všeobecné lekárstvo,Banskobystricky,Brezno
"Všeobecná ambulancia pre dospelých, Závadka nad Hronom, (Medical Help s.r.o.)",https://www.e-vuc.sk/bbsk/zdravotnictvo/ambulantne-zdravotnicke-zariadenia/brezno/vseobecna-ambulancia-pre-dospelych-zavadka-nad-hronom-medical-help.html?page_id=141323, Všeobecné lekárstvo,Banskobystricky,Brezno
"Všeobecná ambulancia pre dospelých, Heľpa, (Medical Help s.r.o.)",https://www.e-vuc.sk/bbsk/zdravotnictvo/ambulantne-zdravotnicke-zariadenia/brezno/vseobecna-ambulancia-pre-dospelych-helpa-medical-help.html?page_id=141324, Všeobecné lekárstvo,Banskobystricky,Brezno
"U-zdrav všeobecná ambulancia pre dospelých (MUDr. Roman Gál), Podbrezová, (U-zdrav. s. r. o.)",https://www.e-vuc.sk/bbsk/zdravotnictvo/ambulantne-zdravotnicke-zariadenia/brezno/u-zdrav-vseobecna-ambulancia-pre-dospelych-mudr.-roman-gal-podbrezova-u-zdrav.-s.-r.-o..html?page_id=140084, Všeobecné lekárstvo,Banskobystricky,Brezno
"Ambulancia rýchlej zdravotnej pomoci, Bystrá, (Nemocnica s poliklinikou Brezno, n.o.)",https://www.e-vuc.sk/bbsk/zdravotnictvo/ambulantne-zdravotnicke-zariadenia/brezno/ambulancia-rychlej-zdravotnej-pomoci-bystra-nemocnica-s-poliklinikou-brezno-n.o..html?page_id=135377, Rýchla zdravotná pomoc,Banskobystricky,Brezno
"Jednodňová zdravotná starostlivosť, cievna chirurgia, Brezno, (Nemocnica s poliklinikou Brezno, n.o.)",https://www.e-vuc.sk/bbsk/zdravotnictvo/ambulantne-zdravotnicke-zariadenia/brezno/jednodnova-zdravotna-starostlivost-cievna-chirurgia-brezno-nemocnica-s-poliklinikou-brezno-n.o..html?page_id=135099, Cievna chirurgia,Banskobystricky,Brezno
"Ambulancia rýchlej zdravotnej pomoci, Pohorelská Maša, (Nemocnica s poliklinikou Brezno, n.o.)",https://www.e-vuc.sk/bbsk/zdravotnictvo/ambulantne-zdravotnicke-zariadenia/brezno/ambulancia-rychlej-zdravotnej-pomoci-pohorelska-masa-nemocnica-s-poliklinikou-brezno-n.o..html?page_id=134772, Rýchla zdravotná pomoc,Banskobystricky,Brezno
"Všeobecná ambulancia pre deti a dorast, MUDr. Erik Richter, Polomka, (AMBERIK s.r.o.)",https://www.e-vuc.sk/bbsk/zdravotnictvo/ambulantne-zdravotnicke-zariadenia/brezno/vseobecna-ambulancia-pre-deti-a-dorast-mudr.-erik-richter-polomka-amberik.html?page_id=134642, Pediatria,Banskobystricky,Brezno
"Gynekologická ambulancia, MUDr. Miroslav Šestina, Podbrezová, (Šestina s.r.o.)",https://www.e-vuc.sk/bbsk/zdravotnictvo/ambulantne-zdravotnicke-zariadenia/brezno/gynekologicka-ambulancia-mudr.-miroslav-sestina-podbrezova-sestina-1.html?page_id=133113," Gynekológia a pôrodníctvo, Ultrazvuk v gynekológii a pôrodníctve",Banskobystricky,Brezno
"Gynekologická ambulancia, MUDr. Miroslav Šestina, Podbrezová, (Šestina s.r.o.)",https://www.e-vuc.sk/bbsk/zdravotnictvo/ambulantne-zdravotnicke-zariadenia/brezno/gynekologicka-ambulancia-mudr.-miroslav-sestina-podbrezova-sestina.html?page_id=133114, Pediatrická gynekológia,Banskobystricky,Brezno
"Ambulancia rýchlej zdravotnej pomoci „S“, Brezno 2, (Nemocnica s poliklinikou Brezno, n.o.)",https://www.e-vuc.sk/bbsk/zdravotnictvo/ambulantne-zdravotnicke-zariadenia/brezno/ambulancia-rychlej-zdravotnej-pomoci-s-brezno-2-nemocnica-s-poliklinikou-brezno-n.o..html?page_id=132773, Rýchla zdravotná pomoc „S“,Banskobystricky,Brezno
"Dispečing dopravnej zdravotnej služby, Brezno, (Nemocnica s poliklinikou Brezno, n.o.)",https://www.e-vuc.sk/bbsk/zdravotnictvo/ambulantne-zdravotnicke-zariadenia/brezno/dispecing-dopravnej-zdravotnej-sluzby-brezno-nemocnica-s-poliklinikou-brezno-n.o..html?page_id=132589,,Banskobystricky,Brezno
"Ambulancia rýchlej lekárskej pomoci, Brezno 1, (Nemocnica s poliklinikou Brezno, n.o.)",https://www.e-vuc.sk/bbsk/zdravotnictvo/ambulantne-zdravotnicke-zariadenia/brezno/ambulancia-rychlej-lekarskej-pomoci-brezno-1-nemocnica-s-poliklinikou-brezno-n.o..html?page_id=132588, Rýchla lekárska pomoc,Banskobystricky,Brezno
"Psychiatrická ambulancia, Brezno, (Nemocnica s poliklinikou Brezno, n.o.)",https://www.e-vuc.sk/bbsk/zdravotnictvo/ambulantne-zdravotnicke-zariadenia/brezno/psychiatricka-ambulancia-brezno-nemocnica-s-poliklinikou-brezno-n.o..html?page_id=131183," Psychiatria, Psychoterapia",Banskobystricky,Brezno
"ADOS, Hlavná, Heľpa, (ADOS Maková s.r.o.)",https://www.e-vuc.sk/bbsk/zdravotnictvo/ambulantne-zdravotnicke-zariadenia/brezno/ados-hlavna-helpa-ados-makova.html?page_id=130830, Domáca ošetrovateľská starostlivosť,Banskobystricky,Brezno
"Všeobecná ambulancia pre dospelých, Pohorelá, (Merci n.o.)",https://www.e-vuc.sk/bbsk/zdravotnictvo/ambulantne-zdravotnicke-zariadenia/brezno/vseobecna-ambulancia-pre-dospelych-pohorela-merci-n.o..html?page_id=130671,!,Banskobystricky,Brezno
"Ambulancia zubného lekárstva, MUDr. Andrea Šrámková Kvietková, Brezno, (Adent s.r.o.)",https://www.e-vuc.sk/bbsk/zdravotnictvo/ambulantne-zdravotnicke-zariadenia/brezno/ambulancia-zubneho-lekarstva-mudr.-andrea-sramkova-kvietkova-brezno-adent.html?page_id=129607, Zubné lekárstvo,Banskobystricky,Brezno
"Všeobecná ambulancia pre dospelých, MUDr. Beata Dikaszová, Beňuš, (B-D Medic, s.r.o.)",https://www.e-vuc.sk/bbsk/zdravotnictvo/ambulantne-zdravotnicke-zariadenia/brezno/vseobecna-ambulancia-pre-dospelych-mudr.-beata-dikaszova-benus-b-d-medic.html?page_id=129304, Všeobecné lekárstvo,Banskobystricky,Brezno
"Všeobecná ambulancia pre dospelých, Heľpa, (Merci n.o.)",https://www.e-vuc.sk/bbsk/zdravotnictvo/ambulantne-zdravotnicke-zariadenia/brezno/vseobecna-ambulancia-pre-dospelych-helpa-merci-n.o..html?page_id=128410,!,Banskobystricky,Brezno
"Všeobecná ambulancia pre dospelých, MUDr. Janka Adamčáková, Brezno, (MEDIJANE s.r.o.)",https://www.e-vuc.sk/bbsk/zdravotnictvo/ambulantne-zdravotnicke-zariadenia/brezno/vseobecna-ambulancia-pre-dospelych-mudr.-janka-adamcakova-brezno-medijane.html?page_id=127850, Všeobecné lekárstvo,Banskobystricky,Brezno
"Ambulancia zubného lekárstva, Brezno, (DL smile, s.r.o.)",https://www.e-vuc.sk/bbsk/zdravotnictvo/ambulantne-zdravotnicke-zariadenia/brezno/ambulancia-zubneho-lekarstva-brezno-dl-smile.html?page_id=127805, Zubné lekárstvo,Banskobystricky,Brezno
"Ambulancia dentálnej hygieny, Brezno, (DL smile, s.r.o.)",https://www.e-vuc.sk/bbsk/zdravotnictvo/ambulantne-zdravotnicke-zariadenia/brezno/ambulancia-dentalnej-hygieny-brezno-dl-smile.html?page_id=127804, Dentálna hygiena,Banskobystricky,Brezno
"Ambulancia čeľustnej ortopédie, Brezno, (Krošláková, s.r.o.)",https://www.e-vuc.sk/bbsk/zdravotnictvo/ambulantne-zdravotnicke-zariadenia/brezno/ambulancia-celustnej-ortopedie-brezno-kroslakova.html?page_id=126274, čeľustná ortopédia,Banskobystricky,Brezno
"Ambulancia zubného lekárstva, Brezno, (Krošláková, s.r.o.)",https://www.e-vuc.sk/bbsk/zdravotnictvo/ambulantne-zdravotnicke-zariadenia/brezno/ambulancia-zubneho-lekarstva-brezno-kroslakova.html?page_id=126273, Zubné lekárstvo,Banskobystricky,Brezno
"Otorinolaryngologická ambulancia, MUDr. Darina Miková, Brezno, (EM - MED, s.r.o.)",https://www.e-vuc.sk/bbsk/zdravotnictvo/ambulantne-zdravotnicke-zariadenia/brezno/otorinolaryngologicka-ambulancia-mudr.-darina-mikova-brezno-em-med.html?page_id=126113, Otorinolaryngológia,Banskobystricky,Brezno
"Všeobecná ambulancia pre deti a dorast, Podbrezová, (LMP-BB s.r.o.)",https://www.e-vuc.sk/bbsk/zdravotnictvo/ambulantne-zdravotnicke-zariadenia/brezno/vseobecna-ambulancia-pre-deti-a-dorast-podbrezova-lmp-bb.html?page_id=122153, Pediatria,Banskobystricky,Brezno
"Všeobecná ambulancia pre dospelých, Pohronská Polhora, (TATRAMEDIK  s.r.o.)",https://www.e-vuc.sk/bbsk/zdravotnictvo/ambulantne-zdravotnicke-zariadenia/brezno/vseobecna-ambulancia-pre-dospelych-pohronska-polhora-tatramedik.html?page_id=121508, Všeobecné lekárstvo,Banskobystricky,Brezno
"Ambulancia zubného lekárstva, MDDr. Simona Varholáková, Podbrezová, (SIMIdent, s.r.o.)",https://www.e-vuc.sk/bbsk/zdravotnictvo/ambulantne-zdravotnicke-zariadenia/brezno/ambulancia-zubneho-lekarstva-mddr.-simona-varholakova-podbrezova-simident.html?page_id=121178, Zubné lekárstvo,Banskobystricky,Brezno
"Kardiologická ambulancia, Brezno, (Nemocnica s poliklinikou Brezno, n.o.)",https://www.e-vuc.sk/bbsk/zdravotnictvo/ambulantne-zdravotnicke-zariadenia/brezno/kardiologicka-ambulancia-brezno-nemocnica-s-poliklinikou-brezno-n.o..html?page_id=108132, Kardiológia,Banskobystricky,Brezno
"Jednodňová zdravotná starostlivosť, urológia, Brezno, (Nemocnica s poliklinikou Brezno, n.o.)",https://www.e-vuc.sk/bbsk/zdravotnictvo/ambulantne-zdravotnicke-zariadenia/brezno/jednodnova-zdravotna-starostlivost-urologia-brezno-nemocnica-s-poliklinikou-brezno-n.o..html?page_id=105375, Urológia,Banskobystricky,Brezno
"Ambulancia čeľustnej ortopédie, Brezno, (ADO-MED s. r. o.)",https://www.e-vuc.sk/bbsk/zdravotnictvo/ambulantne-zdravotnicke-zariadenia/brezno/ambulancia-celustnej-ortopedie-brezno-ado-med-s.-r.-o..html?page_id=104755, čeľustná ortopédia,Banskobystricky,Brezno
"Detská ambulancia - expekt. lôžko, Brezno, (Nemocnica s poliklinikou Brezno, n.o.)",https://www.e-vuc.sk/bbsk/zdravotnictvo/ambulantne-zdravotnicke-zariadenia/brezno/detska-ambulancia-expekt.-lozko-brezno-nemocnica-s-poliklinikou-brezno-n.o..html?page_id=104529, Pediatria,Banskobystricky,Brezno
"SVaLZ, klinická mikrobiológia, Brezno, (Nemocnica s poliklinikou Brezno, n.o.)",https://www.e-vuc.sk/bbsk/zdravotnictvo/ambulantne-zdravotnicke-zariadenia/brezno/svalz-klinicka-mikrobiologia-brezno-nemocnica-s-poliklinikou-brezno-n.o..html?page_id=104521, Klinická mikrobiológia,Banskobystricky,Brezno
"SVaLZ, rádiológia, Brezno, (Nemocnica s poliklinikou Brezno, n.o.)",https://www.e-vuc.sk/bbsk/zdravotnictvo/ambulantne-zdravotnicke-zariadenia/brezno/svalz-radiologia-brezno-nemocnica-s-poliklinikou-brezno-n.o.-1.html?page_id=104517, Rádiológia,Banskobystricky,Brezno
"SVaLZ, rádiológia, Brezno, (Nemocnica s poliklinikou Brezno, n.o.)",https://www.e-vuc.sk/bbsk/zdravotnictvo/ambulantne-zdravotnicke-zariadenia/brezno/svalz-radiologia-brezno-nemocnica-s-poliklinikou-brezno-n.o..html?page_id=104518, Rádiológia,Banskobystricky,Brezno
"SVaLZ, klinická biochémia, Brezno, (Nemocnica s poliklinikou Brezno, n.o.)",https://www.e-vuc.sk/bbsk/zdravotnictvo/ambulantne-zdravotnicke-zariadenia/brezno/svalz-klinicka-biochemia-brezno-nemocnica-s-poliklinikou-brezno-n.o..html?page_id=104519, Klinická biochémia,Banskobystricky,Brezno
"SVaLZ, patologická anatómia, Brezno, (Nemocnica s poliklinikou Brezno, n.o.)",https://www.e-vuc.sk/bbsk/zdravotnictvo/ambulantne-zdravotnicke-zariadenia/brezno/svalz-patologicka-anatomia-brezno-nemocnica-s-poliklinikou-brezno-n.o..html?page_id=104520, Patologická anatómia,Banskobystricky,Brezno
"Ambulancia vnútorného lekárstva, MUDr. Daniela Štellerová, Brezno, (Nemocnica s poliklinikou Brezno, n.o.)",https://www.e-vuc.sk/bbsk/zdravotnictvo/ambulantne-zdravotnicke-zariadenia/brezno/ambulancia-vnutorneho-lekarstva-mudr.-daniela-stellerova-brezno-nemocnica-s-poliklinikou-brezno-n.o..html?page_id=104369, Vnútorné lekárstvo,Banskobystricky,Brezno
"Ambulancia klinickej psychológie, Brezno, (KLIP s.r.o.)",https://www.e-vuc.sk/bbsk/zdravotnictvo/ambulantne-zdravotnicke-zariadenia/brezno/ambulancia-klinickej-psychologie-brezno-klip.html?page_id=103697," Klinická psychológia, Dopravná psychológia, Psychoterapia",Banskobystricky,Brezno
"Reumatologická ambulancia, Brezno, (MUDr. Ľuboslava Kováčiková)",https://www.e-vuc.sk/bbsk/zdravotnictvo/ambulantne-zdravotnicke-zariadenia/brezno/reumatologicka-ambulancia-brezno-mudr.-luboslava-kovacikova.html?page_id=103588, Reumatológia,Banskobystricky,Brezno
"GYNASA, spol. s r.o., Brezno, (GYNASA, spol. s r. o.)",https://www.e-vuc.sk/bbsk/zdravotnictvo/ambulantne-zdravotnicke-zariadenia/brezno/gynasa-spol.-s-r.o.-brezno-gynasa-spol.-s-r.-o..html?page_id=96928, Gynekológia a pôrodníctvo,Banskobystricky,Brezno
"Ambulancia fyziatrie, balneológie a liečebnej rehabilitácie, Podbrezová, (ŽP Rehabilitácia s.r.o.)",https://www.e-vuc.sk/bbsk/zdravotnictvo/ambulantne-zdravotnicke-zariadenia/brezno/ambulancia-fyziatrie-balneologie-a-liecebnej-rehabilitacie-podbrezova-zp-rehabilitacia.html?page_id=96758," Fyziatria, balneológia a liečebná rehabilitácia",Banskobystricky,Brezno
"SVaLZ, fyziatria, balneológia a liečebná rehabilitácia, Podbrezová, (ŽP Rehabilitácia s.r.o.)",https://www.e-vuc.sk/bbsk/zdravotnictvo/ambulantne-zdravotnicke-zariadenia/brezno/svalz-fyziatria-balneologia-a-liecebna-rehabilitacia-podbrezova-zp-rehabilitacia.html?page_id=96759," Fyziatria, balneológia a liečebná rehabilitácia",Banskobystricky,Brezno
"Všeobecná ambulancia pre dospelých, Brezno, (ÍSIS s. r. o.)",https://www.e-vuc.sk/bbsk/zdravotnictvo/ambulantne-zdravotnicke-zariadenia/brezno/vseobecna-ambulancia-pre-dospelych-brezno-isis-s.-r.-o..html?page_id=96714, Všeobecné lekárstvo,Banskobystricky,Brezno
"Všeobecná ambulancia pre dospelých, Čierny Balog, (ÍSIS s. r. o.)",https://www.e-vuc.sk/bbsk/zdravotnictvo/ambulantne-zdravotnicke-zariadenia/brezno/vseobecna-ambulancia-pre-dospelych-cierny-balog-isis-s.-r.-o..html?page_id=96715, Všeobecné lekárstvo,Banskobystricky,Brezno
"ADOS, Námestie gen. M.R.Štefánika, Brezno, (ÍSIS s. r. o.)",https://www.e-vuc.sk/bbsk/zdravotnictvo/ambulantne-zdravotnicke-zariadenia/brezno/ados-namestie-gen.-m.r.stefanika-brezno-isis-s.-r.-o..html?page_id=96711, Domáca ošetrovateľská starostlivosť,Banskobystricky,Brezno
"Geriatrická ambulancia, Čierny Balog, (ÍSIS s. r. o.)",https://www.e-vuc.sk/bbsk/zdravotnictvo/ambulantne-zdravotnicke-zariadenia/brezno/geriatricka-ambulancia-cierny-balog-isis-s.-r.-o..html?page_id=96712, Geriatria,Banskobystricky,Brezno
"Geriatrická ambulancia, Brezno, (ÍSIS s. r. o.)",https://www.e-vuc.sk/bbsk/zdravotnictvo/ambulantne-zdravotnicke-zariadenia/brezno/geriatricka-ambulancia-brezno-isis-s.-r.-o..html?page_id=96713, Geriatria,Banskobystricky,Brezno
"Všeobecná ambulancia pre dospelých, Polomka, (TAMAMED, s.r.o.)",https://www.e-vuc.sk/bbsk/zdravotnictvo/ambulantne-zdravotnicke-zariadenia/brezno/vseobecna-ambulancia-pre-dospelych-polomka-tamamed.html?page_id=96460, Všeobecné lekárstvo,Banskobystricky,Brezno
"Stacionár, všeobecná starostlivosť o deti a dorast, Brezno, (S V E J A N v.o.s.)",https://www.e-vuc.sk/bbsk/zdravotnictvo/ambulantne-zdravotnicke-zariadenia/brezno/stacionar-vseobecna-starostlivost-o-deti-a-dorast-brezno-s-v-e-j-a-n-v.o.s..html?page_id=96352, Všeobecná starostlivosť o deti a dorast,Banskobystricky,Brezno
"SVaLZ, rádiológia, Brezno, (SCHNEIDER RTG - BB, spol. s.r.o.)",https://www.e-vuc.sk/bbsk/zdravotnictvo/ambulantne-zdravotnicke-zariadenia/brezno/svalz-radiologia-brezno-schneider-rtg-bb-spol..html?page_id=96267, Rádiológia,Banskobystricky,Brezno
"Jednodňová zdravotná starostlivosť, gynekológia a pôrodníctvo, Brezno, (SABA-GYN s. r. o.)",https://www.e-vuc.sk/bbsk/zdravotnictvo/ambulantne-zdravotnicke-zariadenia/brezno/jednodnova-zdravotna-starostlivost-gynekologia-a-porodnictvo-brezno-saba-gyn-s.-r.-o..html?page_id=96242, Gynekológia a pôrodníctvo,Banskobystricky,Brezno
"Ambulancia diabetológie a porúch látkovej premeny a výživy, Brezno, (SABA-GYN s. r. o.)",https://www.e-vuc.sk/bbsk/zdravotnictvo/ambulantne-zdravotnicke-zariadenia/brezno/ambulancia-diabetologie-a-poruch-latkovej-premeny-a-vyzivy-brezno-saba-gyn-s.-r.-o..html?page_id=96238," Diabetológia, poruchy látkovej premeny a výživy",Banskobystricky,Brezno
"Ambulancia vnútorného lekárstva, Brezno, (SABA-GYN s. r. o.)",https://www.e-vuc.sk/bbsk/zdravotnictvo/ambulantne-zdravotnicke-zariadenia/brezno/ambulancia-vnutorneho-lekarstva-brezno-saba-gyn-s.-r.-o..html?page_id=96239, Vnútorné lekárstvo,Banskobystricky,Brezno
"Gynekologická ambulancia, Brezno, (SABA-GYN s. r. o.)",https://www.e-vuc.sk/bbsk/zdravotnictvo/ambulantne-zdravotnicke-zariadenia/brezno/gynekologicka-ambulancia-brezno-saba-gyn-s.-r.-o..html?page_id=96240," Gynekológia a pôrodníctvo, Ultrazvuk v gynekológii a pôrodníctve",Banskobystricky,Brezno
"SVaLZ, diplomovaný fyzioterapeut, Heľpa, (Rehabilitácia Fiľová,v.o.s.)",https://www.e-vuc.sk/bbsk/zdravotnictvo/ambulantne-zdravotnicke-zariadenia/brezno/svalz-diplomovany-fyzioterapeut-helpa-rehabilitacia-filovav.o.s..html?page_id=96182, Diplomovaný fyzioterapeut,Banskobystricky,Brezno
"Všeobecná ambulancia pre dospelých, Podbrezová, (Psotka Med s.r.o.)",https://www.e-vuc.sk/bbsk/zdravotnictvo/ambulantne-zdravotnicke-zariadenia/brezno/vseobecna-ambulancia-pre-dospelych-podbrezova-psotka-med.html?page_id=96107, Všeobecné lekárstvo,Banskobystricky,Brezno
"Všeobecná ambulancia pre dospelých, Brezno, (Psotka Med s.r.o.)",https://www.e-vuc.sk/bbsk/zdravotnictvo/ambulantne-zdravotnicke-zariadenia/brezno/vseobecna-ambulancia-pre-dospelych-brezno-psotka-med.html?page_id=96106, Všeobecné lekárstvo,Banskobystricky,Brezno
"Ambulancia zubného lekárstva, MDDr. Miroslava Košíková, Brezno, (PRODENTAL s.r.o.)",https://www.e-vuc.sk/bbsk/zdravotnictvo/ambulantne-zdravotnicke-zariadenia/brezno/ambulancia-zubneho-lekarstva-mddr.-miroslava-kosikova-brezno-prodental.html?page_id=96095, Zubné lekárstvo,Banskobystricky,Brezno
"Ambulancia klinickej logopédie, Brezno, (PaedDr. Tatiana Dunajská)",https://www.e-vuc.sk/bbsk/zdravotnictvo/ambulantne-zdravotnicke-zariadenia/brezno/ambulancia-klinickej-logopedie-brezno-paeddr.-tatiana-dunajska.html?page_id=95969, Klinická logopédia,Banskobystricky,Brezno
"Endokrinologická ambulancia, Brezno, (Optimed,s.r.o.)",https://www.e-vuc.sk/bbsk/zdravotnictvo/ambulantne-zdravotnicke-zariadenia/brezno/endokrinologicka-ambulancia-brezno-optimed.html?page_id=95881, Endokrinológia,Banskobystricky,Brezno
"Stacionár, diabetológia, poruchy látkovej premeny a výživy, Brezno, (Optimed,s.r.o.)",https://www.e-vuc.sk/bbsk/zdravotnictvo/ambulantne-zdravotnicke-zariadenia/brezno/stacionar-diabetologia-poruchy-latkovej-premeny-a-vyzivy-brezno-optimed.html?page_id=95882," Diabetológia, poruchy látkovej premeny a výživy",Banskobystricky,Brezno
"Stacionár, endokrinológia, Brezno, (Optimed,s.r.o.)",https://www.e-vuc.sk/bbsk/zdravotnictvo/ambulantne-zdravotnicke-zariadenia/brezno/stacionar-endokrinologia-brezno-optimed.html?page_id=95883, Endokrinológia,Banskobystricky,Brezno
"Ambulancia zubného lekárstva, Brezno, (ONDIKOVÁ DENT s.r.o.)",https://www.e-vuc.sk/bbsk/zdravotnictvo/ambulantne-zdravotnicke-zariadenia/brezno/ambulancia-zubneho-lekarstva-brezno-ondikova-dent.html?page_id=95876, Zubné lekárstvo,Banskobystricky,Brezno
"Ambulancia diabetológie a porúch látkovej premeny a výživy, Brezno, (Optimed,s.r.o.)",https://www.e-vuc.sk/bbsk/zdravotnictvo/ambulantne-zdravotnicke-zariadenia/brezno/ambulancia-diabetologie-a-poruch-latkovej-premeny-a-vyzivy-brezno-optimed.html?page_id=95880," Diabetológia, poruchy látkovej premeny a výživy",Banskobystricky,Brezno
"OFTAL s.r.o., Brezno, (OFTAL s. r. o.)",https://www.e-vuc.sk/bbsk/zdravotnictvo/ambulantne-zdravotnicke-zariadenia/brezno/oftal-brezno-oftal-s.-r.-o..html?page_id=95832, Oftalmológia,Banskobystricky,Brezno
"ADOS, Heľpa, Heľpa, (NOVÝ DOMOV n.o.)",https://www.e-vuc.sk/bbsk/zdravotnictvo/ambulantne-zdravotnicke-zariadenia/brezno/ados-helpa-helpa-novy-domov-n.o..html?page_id=95812, Domáca ošetrovateľská starostlivosť,Banskobystricky,Brezno
"Všeobecná ambulancia pre dospelých, MUDr. Ján Pančík, Brezno, (NOVAPHARM, s.r.o.)",https://www.e-vuc.sk/bbsk/zdravotnictvo/ambulantne-zdravotnicke-zariadenia/brezno/vseobecna-ambulancia-pre-dospelych-mudr.-jan-pancik-brezno-novapharm.html?page_id=95804, Všeobecné lekárstvo,Banskobystricky,Brezno
"Jednodňová zdravotná starostlivosť, úrazová chirurgia, Brezno, (Nemocnica s poliklinikou Brezno, n.o.)",https://www.e-vuc.sk/bbsk/zdravotnictvo/ambulantne-zdravotnicke-zariadenia/brezno/jednodnova-zdravotna-starostlivost-urazova-chirurgia-brezno-nemocnica-s-poliklinikou-brezno-n.o..html?page_id=95653, úrazová chirurgia,Banskobystricky,Brezno
"Pediatrická ambulancia, Brezno, (Nemocnica s poliklinikou Brezno, n.o.)",https://www.e-vuc.sk/bbsk/zdravotnictvo/ambulantne-zdravotnicke-zariadenia/brezno/pediatricka-ambulancia-brezno-nemocnica-s-poliklinikou-brezno-n.o..html?page_id=95648, Pediatria,Banskobystricky,Brezno
"Všeobecná ambulancia pre dospelých, Brezno, (Nemocnica s poliklinikou Brezno, n.o.)",https://www.e-vuc.sk/bbsk/zdravotnictvo/ambulantne-zdravotnicke-zariadenia/brezno/vseobecna-ambulancia-pre-dospelych-brezno-nemocnica-s-poliklinikou-brezno-n.o..html?page_id=95649, Všeobecné lekárstvo,Banskobystricky,Brezno
"Jednodňová zdravotná starostlivosť, gynekológia a pôrodníctvo, Brezno, (Nemocnica s poliklinikou Brezno, n.o.)",https://www.e-vuc.sk/bbsk/zdravotnictvo/ambulantne-zdravotnicke-zariadenia/brezno/jednodnova-zdravotna-starostlivost-gynekologia-a-porodnictvo-brezno-nemocnica-s-poliklinikou-brezno-n.o..html?page_id=95650, Gynekológia a pôrodníctvo,Banskobystricky,Brezno
"Jednodňová zdravotná starostlivosť, chirurgia, Brezno, (Nemocnica s poliklinikou Brezno, n.o.)",https://www.e-vuc.sk/bbsk/zdravotnictvo/ambulantne-zdravotnicke-zariadenia/brezno/jednodnova-zdravotna-starostlivost-chirurgia-brezno-nemocnica-s-poliklinikou-brezno-n.o..html?page_id=95651, Chirurgia,Banskobystricky,Brezno
"Jednodňová zdravotná starostlivosť, ortopédia, Brezno, (Nemocnica s poliklinikou Brezno, n.o.)",https://www.e-vuc.sk/bbsk/zdravotnictvo/ambulantne-zdravotnicke-zariadenia/brezno/jednodnova-zdravotna-starostlivost-ortopedia-brezno-nemocnica-s-poliklinikou-brezno-n.o..html?page_id=95652, Ortopédia,Banskobystricky,Brezno
"Psychiatrická ambulancia, Brezno, (Nemocnica s poliklinikou Brezno, n.o.)",https://www.e-vuc.sk/bbsk/zdravotnictvo/ambulantne-zdravotnicke-zariadenia/brezno/psychiatricka-ambulancia-brezno-nemocnica-s-poliklinikou-brezno-n.o.-1.html?page_id=95645, Psychiatria,Banskobystricky,Brezno
"Stacionár, nefrológia, Brezno, (Nemocnica s poliklinikou Brezno, n.o.)",https://www.e-vuc.sk/bbsk/zdravotnictvo/ambulantne-zdravotnicke-zariadenia/brezno/stacionar-nefrologia-brezno-nemocnica-s-poliklinikou-brezno-n.o..html?page_id=95646, Nefrológia,Banskobystricky,Brezno
"Urologická ambulancia, Brezno, (Nemocnica s poliklinikou Brezno, n.o.)",https://www.e-vuc.sk/bbsk/zdravotnictvo/ambulantne-zdravotnicke-zariadenia/brezno/urologicka-ambulancia-brezno-nemocnica-s-poliklinikou-brezno-n.o..html?page_id=95647, Urológia,Banskobystricky,Brezno
"Neurologická ambulancia, MUDr. Ivan Droppa, Brezno, (Nemocnica s poliklinikou Brezno, n.o.)",https://www.e-vuc.sk/bbsk/zdravotnictvo/ambulantne-zdravotnicke-zariadenia/brezno/neurologicka-ambulancia-mudr.-ivan-droppa-brezno-nemocnica-s-poliklinikou-brezno-n.o..html?page_id=95640, Neurológia,Banskobystricky,Brezno
"Neurologická ambulancia, MUDr. Miriama Chovancová, Brezno, (Nemocnica s poliklinikou Brezno, n.o.)",https://www.e-vuc.sk/bbsk/zdravotnictvo/ambulantne-zdravotnicke-zariadenia/brezno/neurologicka-ambulancia-mudr.-miriama-chovancova-brezno-nemocnica-s-poliklinikou-brezno-n.o..html?page_id=95641, Neurológia,Banskobystricky,Brezno
"Pneumologicko-ftizeologická ambulancia, MUDr. Zdena Volentierová, Brezno, (Nemocnica s poliklinikou Brezno, n.o.)",https://www.e-vuc.sk/bbsk/zdravotnictvo/ambulantne-zdravotnicke-zariadenia/brezno/pneumologicko-ftizeologicka-ambulancia-mudr.-zdena-volentierova-brezno-nemocnica-s-poliklinikou-brezno-n.o..html?page_id=95642, Pneumológia a ftizeológia,Banskobystricky,Brezno
"SVaLZ, hematológia a transfuziológia, Brezno, (Nemocnica s poliklinikou Brezno, n.o.)",https://www.e-vuc.sk/bbsk/zdravotnictvo/ambulantne-zdravotnicke-zariadenia/brezno/svalz-hematologia-a-transfuziologia-brezno-nemocnica-s-poliklinikou-brezno-n.o..html?page_id=95635, Hematológia a transfuziológia,Banskobystricky,Brezno
