title,doctor_url,specialization,kraj,okres
"Gynekologická ambulancia, Močenok, (FemiGyn s. r. o.)",https://www.e-vuc.sk/nsk/zdravotnictvo/ambulantne-zdravotnicke-zariadenia/sala/gynekologicka-ambulancia-mocenok-femigyn-s.-r.-o..html?page_id=143540, Gynekológia a pôrodníctvo,Nitriansky,Šaľa
"SVaLZ, rádiológia, Šaľa, (MUDr. Kristína Švecová)",https://www.e-vuc.sk/nsk/zdravotnictvo/ambulantne-zdravotnicke-zariadenia/sala/svalz-radiologia-sala-mudr.-kristina-svecova.html?page_id=143443, Rádiológia,Nitriansky,Šaľa
"Ambulancia zubného lekárstva, Vlčany, (TM-REHAB s.r.o.)",https://www.e-vuc.sk/nsk/zdravotnictvo/ambulantne-zdravotnicke-zariadenia/sala/ambulancia-zubneho-lekarstva-vlcany-tm-rehab.html?page_id=143276, Zubné lekárstvo,Nitriansky,Šaľa
"Ambulancia zubného lekárstva, Šaľa, (TeRI - dent s. r. o.)",https://www.e-vuc.sk/nsk/zdravotnictvo/ambulantne-zdravotnicke-zariadenia/sala/ambulancia-zubneho-lekarstva-sala-teri-dent-s.-r.-o..html?page_id=143246," Zubné lekárstvo, Dentoalveolárna chirurgia",Nitriansky,Šaľa
"Ambulancia zubného lekárstva, Neded, (TeRI - dent s. r. o.)",https://www.e-vuc.sk/nsk/zdravotnictvo/ambulantne-zdravotnicke-zariadenia/sala/ambulancia-zubneho-lekarstva-neded-teri-dent-s.-r.-o..html?page_id=143247," Zubné lekárstvo, Dentoalveolárna chirurgia",Nitriansky,Šaľa
"Všeobecná ambulancia pre dospelých, Šaľa, (VAS - VIVA, s.r.o.)",https://www.e-vuc.sk/nsk/zdravotnictvo/ambulantne-zdravotnicke-zariadenia/sala/vseobecna-ambulancia-pre-dospelych-sala-vas-viva-1.html?page_id=143114, Všeobecné lekárstvo,Nitriansky,Šaľa
"Ambulancia zubného lekárstva, Šaľa, (AW-DENT, s.r.o.)",https://www.e-vuc.sk/nsk/zdravotnictvo/ambulantne-zdravotnicke-zariadenia/sala/ambulancia-zubneho-lekarstva-sala-aw-dent-1.html?page_id=142731," Zubné lekárstvo, čeľustná ortopédia",Nitriansky,Šaľa
"Ambulancia všeobecného lekárstva, MUDr. Vagovičová, Šaľa, (Salbrod, s.r.o.)",https://www.e-vuc.sk/nsk/zdravotnictvo/ambulantne-zdravotnicke-zariadenia/sala/ambulancia-vseobecneho-lekarstva-mudr.-vagovicova-sala-salbrod.html?page_id=142670, Všeobecné lekárstvo,Nitriansky,Šaľa
"Všeobecná ambulancia pre dospelých, Šaľa, (MediElic s.r.o.)",https://www.e-vuc.sk/nsk/zdravotnictvo/ambulantne-zdravotnicke-zariadenia/sala/vseobecna-ambulancia-pre-dospelych-sala-medielic.html?page_id=142550, Všeobecné lekárstvo,Nitriansky,Šaľa
"SVaLZ, rádiológia, Šaľa, (DIAGNOSTICA MEDICA, a.s.)",https://www.e-vuc.sk/nsk/zdravotnictvo/ambulantne-zdravotnicke-zariadenia/sala/svalz-radiologia-sala-diagnostica-medica-a.s.-1.html?page_id=142410, Rádiológia,Nitriansky,Šaľa
"Ambulancia klinickej logopédie, Šaľa, (Mgr. Veronika Halašová)",https://www.e-vuc.sk/nsk/zdravotnictvo/ambulantne-zdravotnicke-zariadenia/sala/ambulancia-klinickej-logopedie-sala-mgr.-veronika-halasova.html?page_id=141852, Klinická logopédia,Nitriansky,Šaľa
"Kardiologická ambulancia, Šaľa, (BalMedic s.r.o.)",https://www.e-vuc.sk/nsk/zdravotnictvo/ambulantne-zdravotnicke-zariadenia/sala/kardiologicka-ambulancia-sala-balmedic.html?page_id=141092, Kardiológia,Nitriansky,Šaľa
"Ortopedická ambulancia, MUDr.Tomáš Kubranský, Šaľa, (T&A group s.r.o.)",https://www.e-vuc.sk/nsk/zdravotnictvo/ambulantne-zdravotnicke-zariadenia/sala/ortopedicka-ambulancia-mudr.tomas-kubransky-sala-ta-group.html?page_id=141001, Ortopédia,Nitriansky,Šaľa
"Psychiatrická ambulancia, MUDr. Martina Bartošovičová, Šaľa, (POKOJ, s. r. o.)",https://www.e-vuc.sk/nsk/zdravotnictvo/ambulantne-zdravotnicke-zariadenia/sala/psychiatricka-ambulancia-mudr.-martina-bartosovicova-sala-pokoj-s.-r.-o..html?page_id=140781, Psychiatria,Nitriansky,Šaľa
"Ambulancia fyziatrie, balneológie a liečebnej rehabilitácie, Neded, (Rehabilitačné centrum TOMI s.r.o.)",https://www.e-vuc.sk/nsk/zdravotnictvo/ambulantne-zdravotnicke-zariadenia/sala/ambulancia-fyziatrie-balneologie-a-liecebnej-rehabilitacie-neded-rehabilitacne-centrum-tomi.html?page_id=135568," Fyziatria, balneológia a liečebná rehabilitácia",Nitriansky,Šaľa
"SVaLZ, fyziatria, balneológia a liečebná rehabilitácia, Neded, (Rehabilitačné centrum TOMI s.r.o.)",https://www.e-vuc.sk/nsk/zdravotnictvo/ambulantne-zdravotnicke-zariadenia/sala/svalz-fyziatria-balneologia-a-liecebna-rehabilitacia-neded-rehabilitacne-centrum-tomi.html?page_id=135569," Fyziatria, balneológia a liečebná rehabilitácia",Nitriansky,Šaľa
"Ambulancia zubného lekárstva, Šaľa, (STORKDENT s.r.o.)",https://www.e-vuc.sk/nsk/zdravotnictvo/ambulantne-zdravotnicke-zariadenia/sala/ambulancia-zubneho-lekarstva-sala-storkdent.html?page_id=135473, Zubné lekárstvo,Nitriansky,Šaľa
"Ambulancia zubného lekárstva, Šaľa, (STORKDENT s.r.o.)",https://www.e-vuc.sk/nsk/zdravotnictvo/ambulantne-zdravotnicke-zariadenia/sala/ambulancia-zubneho-lekarstva-sala-storkdent-2.html?page_id=135474, Zubné lekárstvo,Nitriansky,Šaľa
"Ambulancia zubného lekárstva, Šaľa, (STORKDENT s.r.o.)",https://www.e-vuc.sk/nsk/zdravotnictvo/ambulantne-zdravotnicke-zariadenia/sala/ambulancia-zubneho-lekarstva-sala-storkdent-1.html?page_id=135475, Zubné lekárstvo,Nitriansky,Šaľa
"ADOS, Nemocničná, Šaľa, (ADOS ANJEL, s.r.o.)",https://www.e-vuc.sk/nsk/zdravotnictvo/ambulantne-zdravotnicke-zariadenia/sala/ados-nemocnicna-sala-ados-anjel.html?page_id=135270, Domáca ošetrovateľská starostlivosť,Nitriansky,Šaľa
"Ambulancia vnútorného lekárstva, Šaľa, (MG INTERNAL MEDICINE, s. r. o.)",https://www.e-vuc.sk/nsk/zdravotnictvo/ambulantne-zdravotnicke-zariadenia/sala/ambulancia-vnutorneho-lekarstva-sala-mg-internal-medicine-s.-r.-o..html?page_id=135049, Vnútorné lekárstvo,Nitriansky,Šaľa
"Ambulancia rýchlej lekárskej pomoci, Šaľa 1, (LSE - Life Star Emergency, s.r.o.)",https://www.e-vuc.sk/nsk/zdravotnictvo/ambulantne-zdravotnicke-zariadenia/sala/ambulancia-rychlej-lekarskej-pomoci-sala-1-lse-life-star-emergency.html?page_id=134780, Rýchla lekárska pomoc,Nitriansky,Šaľa
"Ortopedická ambulancia, Šaľa, (OLIMED, s.r.o.)",https://www.e-vuc.sk/nsk/zdravotnictvo/ambulantne-zdravotnicke-zariadenia/sala/ortopedicka-ambulancia-sala-olimed.html?page_id=132906, Ortopédia,Nitriansky,Šaľa
"Všeobecná ambulancia pre dospelých, Trnovec nad Váhom, (IVJAR, s. r. o.)",https://www.e-vuc.sk/nsk/zdravotnictvo/ambulantne-zdravotnicke-zariadenia/sala/vseobecna-ambulancia-pre-dospelych-trnovec-nad-vahom-ivjar-s.-r.-o..html?page_id=132832, Všeobecné lekárstvo,Nitriansky,Šaľa
"Ambulancia rýchlej zdravotnej pomoci, Šaľa 2, (LSE - Life Star Emergency, s.r.o.)",https://www.e-vuc.sk/nsk/zdravotnictvo/ambulantne-zdravotnicke-zariadenia/sala/ambulancia-rychlej-zdravotnej-pomoci-sala-2-lse-life-star-emergency.html?page_id=132562, Rýchla zdravotná pomoc,Nitriansky,Šaľa
"Všeobecná ambulancia pre dospelých, Šaľa, (NŠH s.r.o.)",https://www.e-vuc.sk/nsk/zdravotnictvo/ambulantne-zdravotnicke-zariadenia/sala/vseobecna-ambulancia-pre-dospelych-sala-nsh.html?page_id=132115, Všeobecné lekárstvo,Nitriansky,Šaľa
"Všeobecná ambulancia pre deti a dorast, Močenok, (MUDr. Mária Prablesková s.r.o.)",https://www.e-vuc.sk/nsk/zdravotnictvo/ambulantne-zdravotnicke-zariadenia/sala/vseobecna-ambulancia-pre-deti-a-dorast-mocenok-mudr.-maria-prableskova.html?page_id=130664," Pediatria, Dorastové lekárstvo",Nitriansky,Šaľa
"Všeobecná ambulancia pre dospelých, Neded, (MUDr. Peter Bakič s.r.o.)",https://www.e-vuc.sk/nsk/zdravotnictvo/ambulantne-zdravotnicke-zariadenia/sala/vseobecna-ambulancia-pre-dospelych-neded-mudr.-peter-bakic.html?page_id=130369, Všeobecné lekárstvo,Nitriansky,Šaľa
"Gynekologická ambulancia, Šaľa, (MEDI-GAMA s.r.o.)",https://www.e-vuc.sk/nsk/zdravotnictvo/ambulantne-zdravotnicke-zariadenia/sala/gynekologicka-ambulancia-sala-medi-gama.html?page_id=130286, Gynekológia a pôrodníctvo,Nitriansky,Šaľa
"Všeobecná ambulancia pre dospelých, Tešedíkovo, (Mihop s.r.o.)",https://www.e-vuc.sk/nsk/zdravotnictvo/ambulantne-zdravotnicke-zariadenia/sala/vseobecna-ambulancia-pre-dospelych-tesedikovo-mihop.html?page_id=129657, Všeobecné lekárstvo,Nitriansky,Šaľa
"Neurologická ambulancia, MUDr. Bese László, Šaľa, (BeseMed s.r.o.)",https://www.e-vuc.sk/nsk/zdravotnictvo/ambulantne-zdravotnicke-zariadenia/sala/neurologicka-ambulancia-mudr.-bese-laszlo-sala-besemed.html?page_id=128175, Neurológia,Nitriansky,Šaľa
"SVaLZ, rádiológia, Šaľa, (RADEVA s.r.o.)",https://www.e-vuc.sk/nsk/zdravotnictvo/ambulantne-zdravotnicke-zariadenia/sala/svalz-radiologia-sala-radeva.html?page_id=126875, Rádiológia,Nitriansky,Šaľa
"ADOS, Nemocničná, Šaľa, (ADOS - ANJEL n.o.)",https://www.e-vuc.sk/nsk/zdravotnictvo/ambulantne-zdravotnicke-zariadenia/sala/ados-nemocnicna-sala-ados-anjel-n.o..html?page_id=125589, Domáca ošetrovateľská starostlivosť,Nitriansky,Šaľa
"Ambulancia dentálnej hygieny, Bc. Petronela Dovalovská, Šaľa, (Bc. Petronela Dovalovská)",https://www.e-vuc.sk/nsk/zdravotnictvo/ambulantne-zdravotnicke-zariadenia/sala/ambulancia-dentalnej-hygieny-bc.-petronela-dovalovska-sala-bc.-petronela-dovalovska.html?page_id=124602, Dentálna hygiena,Nitriansky,Šaľa
"Gynekologická ambulancia, Močenok, (ITAR s.r.o.)",https://www.e-vuc.sk/nsk/zdravotnictvo/ambulantne-zdravotnicke-zariadenia/sala/gynekologicka-ambulancia-mocenok-itar.html?page_id=123152, Gynekológia a pôrodníctvo,Nitriansky,Šaľa
"SVaLZ, fyziatria, balneológia a liečebná rehabilitácia, Močenok, (DLV - REHA s.r.o.)",https://www.e-vuc.sk/nsk/zdravotnictvo/ambulantne-zdravotnicke-zariadenia/sala/svalz-fyziatria-balneologia-a-liecebna-rehabilitacia-mocenok-dlv-reha.html?page_id=120585," Fyziatria, balneológia a liečebná rehabilitácia",Nitriansky,Šaľa
"Geriatrická ambulancia, Šaľa, (MEDIDAN, s.r.o.)",https://www.e-vuc.sk/nsk/zdravotnictvo/ambulantne-zdravotnicke-zariadenia/sala/geriatricka-ambulancia-sala-medidan.html?page_id=120323, Geriatria,Nitriansky,Šaľa
"SVaLZ, fyziatria, balneológia a liečebná rehabilitácia, Šaľa, (CHARTRES, s.r.o.)",https://www.e-vuc.sk/nsk/zdravotnictvo/ambulantne-zdravotnicke-zariadenia/sala/svalz-fyziatria-balneologia-a-liecebna-rehabilitacia-sala-chartres.html?page_id=105514," Fyziatria, balneológia a liečebná rehabilitácia",Nitriansky,Šaľa
"Psychiatrická ambulancia, Šaľa, (Empathia - Sabi, s.r.o.)",https://www.e-vuc.sk/nsk/zdravotnictvo/ambulantne-zdravotnicke-zariadenia/sala/psychiatricka-ambulancia-sala-empathia-sabi.html?page_id=97003, Psychiatria,Nitriansky,Šaľa
"Poliklinika, Šaľa, (Duslo, a.s.)",https://www.e-vuc.sk/nsk/zdravotnictvo/ambulantne-zdravotnicke-zariadenia/sala/poliklinika-sala-duslo-a.s.-3.html?page_id=92755, Všeobecné lekárstvo,Nitriansky,Šaľa
"Poliklinika, Šaľa, (Duslo, a.s.)",https://www.e-vuc.sk/nsk/zdravotnictvo/ambulantne-zdravotnicke-zariadenia/sala/poliklinika-sala-duslo-a.s.-4.html?page_id=92754, Zubné lekárstvo,Nitriansky,Šaľa
"Ambulancia zubného lekárstva, Močenok, (STOMMED s.r.o.)",https://www.e-vuc.sk/nsk/zdravotnictvo/ambulantne-zdravotnicke-zariadenia/sala/ambulancia-zubneho-lekarstva-mocenok-stommed.html?page_id=92107, Zubné lekárstvo,Nitriansky,Šaľa
"Všeobecná ambulancia pre deti a dorast, Šaľa, (SANABO, s.r.o.)",https://www.e-vuc.sk/nsk/zdravotnictvo/ambulantne-zdravotnicke-zariadenia/sala/vseobecna-ambulancia-pre-deti-a-dorast-sala-sanabo.html?page_id=89667, Všeobecná starostlivosť o deti a dorast,Nitriansky,Šaľa
"SVaLZ, osteodenzitometria, Šaľa, (REVITA - MediCentrum, s.r.o.)",https://www.e-vuc.sk/nsk/zdravotnictvo/ambulantne-zdravotnicke-zariadenia/sala/svalz-osteodenzitometria-sala-revita-medicentrum.html?page_id=89666, Osteodenzitometria,Nitriansky,Šaľa
"Ambulancia zubného lekárstva, Šaľa, (MUDr. Zuzana Gombíková)",https://www.e-vuc.sk/nsk/zdravotnictvo/ambulantne-zdravotnicke-zariadenia/sala/ambulancia-zubneho-lekarstva-sala-mudr.-zuzana-gombikova.html?page_id=89596, Zubné lekárstvo,Nitriansky,Šaľa
"Všeobecná ambulancia pre deti a dorast, MUDr Kissová Eva, Vlčany, (MEDIKISS, s.r.o.)",https://www.e-vuc.sk/nsk/zdravotnictvo/ambulantne-zdravotnicke-zariadenia/sala/vseobecna-ambulancia-pre-deti-a-dorast-mudr-kissova-eva-vlcany-medikiss.html?page_id=89491, Všeobecná starostlivosť o deti a dorast,Nitriansky,Šaľa
"Gynekologická ambulancia, Šaľa, (VISSEGYN, s.r.o.)",https://www.e-vuc.sk/nsk/zdravotnictvo/ambulantne-zdravotnicke-zariadenia/sala/gynekologicka-ambulancia-sala-vissegyn.html?page_id=89340, Gynekológia a pôrodníctvo,Nitriansky,Šaľa
"Ambulancia klinickej psychológie, Šaľa, (Via Vitae s.r.o.)",https://www.e-vuc.sk/nsk/zdravotnictvo/ambulantne-zdravotnicke-zariadenia/sala/ambulancia-klinickej-psychologie-sala-via-vitae.html?page_id=89333," Klinická psychológia, Psychoterapia",Nitriansky,Šaľa
"Dermatovenerologická ambulancia, Šaľa, (VERADERM s.r.o.)",https://www.e-vuc.sk/nsk/zdravotnictvo/ambulantne-zdravotnicke-zariadenia/sala/dermatovenerologicka-ambulancia-sala-veraderm.html?page_id=89328, Dermatovenerológia,Nitriansky,Šaľa
"Všeobecná ambulancia pre dospelých, Šaľa, (VAS - VIVA, s.r.o.)",https://www.e-vuc.sk/nsk/zdravotnictvo/ambulantne-zdravotnicke-zariadenia/sala/vseobecna-ambulancia-pre-dospelych-sala-vas-viva.html?page_id=89324, Všeobecné lekárstvo,Nitriansky,Šaľa
"Chirurgická ambulancia, MUDr. Marián Vagovič, Šaľa, (VAGMAR s.r.o.)",https://www.e-vuc.sk/nsk/zdravotnictvo/ambulantne-zdravotnicke-zariadenia/sala/chirurgicka-ambulancia-mudr.-marian-vagovic-sala-vagmar.html?page_id=89321, Chirurgia,Nitriansky,Šaľa
"Ambulancia pediatrickej urológie, Šaľa, (Urologická ambulancia MUDr. Ivan Križan, s.r.o.)",https://www.e-vuc.sk/nsk/zdravotnictvo/ambulantne-zdravotnicke-zariadenia/sala/ambulancia-pediatrickej-urologie-sala-urologicka-ambulancia-mudr.-ivan-krizan.html?page_id=89312, Pediatrická urológia,Nitriansky,Šaľa
"Urologická ambulancia, Šaľa, (Urologická ambulancia MUDr. Ivan Križan, s.r.o.)",https://www.e-vuc.sk/nsk/zdravotnictvo/ambulantne-zdravotnicke-zariadenia/sala/urologicka-ambulancia-sala-urologicka-ambulancia-mudr.-ivan-krizan.html?page_id=89311, Urológia,Nitriansky,Šaľa
"Urologická ambulancia, Šaľa, (UROCENTRUM ŠAĽA, s.r.o.)",https://www.e-vuc.sk/nsk/zdravotnictvo/ambulantne-zdravotnicke-zariadenia/sala/urologicka-ambulancia-sala-urocentrum-sala.html?page_id=89308," Urológia, Intervenčná ultrasonografia v urológii",Nitriansky,Šaľa
"Gynekologická ambulancia, Šaľa, (U starostlivého medvedíka s.r.o.)",https://www.e-vuc.sk/nsk/zdravotnictvo/ambulantne-zdravotnicke-zariadenia/sala/gynekologicka-ambulancia-sala-u-starostliveho-medvedika.html?page_id=89298, Gynekológia a pôrodníctvo,Nitriansky,Šaľa
"Ambulancia zubného lekárstva, Šaľa, (TOMA DENT, s.r.o.)",https://www.e-vuc.sk/nsk/zdravotnictvo/ambulantne-zdravotnicke-zariadenia/sala/ambulancia-zubneho-lekarstva-sala-toma-dent.html?page_id=89278," Zubné lekárstvo, Rádiológia",Nitriansky,Šaľa
"Všeobecná ambulancia pre deti a dorast, Eva Radvanská, MUDr., PhD., Šaľa, (SZALAMED, s.r.o.)",https://www.e-vuc.sk/nsk/zdravotnictvo/ambulantne-zdravotnicke-zariadenia/sala/vseobecna-ambulancia-pre-deti-a-dorast-eva-radvanska-mudr.-phd.-sala-szalamed.html?page_id=89266, Všeobecná starostlivosť o deti a dorast,Nitriansky,Šaľa
"Ambulancia zubného lekárstva, Tešedíkovo, (STORKDENT s.r.o.)",https://www.e-vuc.sk/nsk/zdravotnictvo/ambulantne-zdravotnicke-zariadenia/sala/ambulancia-zubneho-lekarstva-tesedikovo-storkdent.html?page_id=89253, Zubné lekárstvo,Nitriansky,Šaľa
"Všeobecná ambulancia pre dospelých, Šaľa, (SIZK, s r.o.)",https://www.e-vuc.sk/nsk/zdravotnictvo/ambulantne-zdravotnicke-zariadenia/sala/vseobecna-ambulancia-pre-dospelych-sala-sizk-s-r.o..html?page_id=89222, Všeobecné lekárstvo,Nitriansky,Šaľa
"Ambulancia vnútorného lekárstva, Šaľa, (SIZK, s r.o.)",https://www.e-vuc.sk/nsk/zdravotnictvo/ambulantne-zdravotnicke-zariadenia/sala/ambulancia-vnutorneho-lekarstva-sala-sizk-s-r.o..html?page_id=89221, Vnútorné lekárstvo,Nitriansky,Šaľa
"Ambulancia zubného lekárstva, Šaľa, (SAVEDENT s.r.o.)",https://www.e-vuc.sk/nsk/zdravotnictvo/ambulantne-zdravotnicke-zariadenia/sala/ambulancia-zubneho-lekarstva-sala-savedent.html?page_id=89216, Zubné lekárstvo,Nitriansky,Šaľa
"Nefrologická ambulancia, Šaľa, (SANABO, s.r.o.)",https://www.e-vuc.sk/nsk/zdravotnictvo/ambulantne-zdravotnicke-zariadenia/sala/nefrologicka-ambulancia-sala-sanabo.html?page_id=89202, Nefrológia,Nitriansky,Šaľa
"Všeobecná ambulancia pre dospelých, Šaľa, (ROVAMED, s.r.o.)",https://www.e-vuc.sk/nsk/zdravotnictvo/ambulantne-zdravotnicke-zariadenia/sala/vseobecna-ambulancia-pre-dospelych-sala-rovamed.html?page_id=89184, Všeobecné lekárstvo,Nitriansky,Šaľa
"Gynekologická ambulancia, MUDr. Kamil Vaško, Šaľa, (RANA, s.r.o.)",https://www.e-vuc.sk/nsk/zdravotnictvo/ambulantne-zdravotnicke-zariadenia/sala/gynekologicka-ambulancia-mudr.-kamil-vasko-sala-rana.html?page_id=89154," Gynekológia a pôrodníctvo, Ultrazvuk v gynekológii a pôrodníctve",Nitriansky,Šaľa
"Všeobecná ambulancia pre deti a dorast, MUDr. Janka Vašková, Šaľa, (RANA, s.r.o.)",https://www.e-vuc.sk/nsk/zdravotnictvo/ambulantne-zdravotnicke-zariadenia/sala/vseobecna-ambulancia-pre-deti-a-dorast-mudr.-janka-vaskova-sala-rana.html?page_id=89153, Všeobecná starostlivosť o deti a dorast,Nitriansky,Šaľa
"Ambulancia klinickej imunológie a alergológie, Šaľa, (Pollens, s.r.o.)",https://www.e-vuc.sk/nsk/zdravotnictvo/ambulantne-zdravotnicke-zariadenia/sala/ambulancia-klinickej-imunologie-a-alergologie-sala-pollens.html?page_id=89112, Klinická imunológia a alergológia,Nitriansky,Šaľa
"Pneumologicko-ftizeologická ambulancia, Šaľa, (PNEUMO-ONKO s.r.o.)",https://www.e-vuc.sk/nsk/zdravotnictvo/ambulantne-zdravotnicke-zariadenia/sala/pneumologicko-ftizeologicka-ambulancia-sala-pneumo-onko.html?page_id=89107, Pneumológia a ftizeológia,Nitriansky,Šaľa
"Neurologická ambulancia, Šaľa, (OLIMED, s.r.o.)",https://www.e-vuc.sk/nsk/zdravotnictvo/ambulantne-zdravotnicke-zariadenia/sala/neurologicka-ambulancia-sala-olimed.html?page_id=89020, Neurológia,Nitriansky,Šaľa
"Oftalmologická ambulancia, Šaľa, (OFTABRAND s.r.o.)",https://www.e-vuc.sk/nsk/zdravotnictvo/ambulantne-zdravotnicke-zariadenia/sala/oftalmologicka-ambulancia-sala-oftabrand.html?page_id=89015, Oftalmológia,Nitriansky,Šaľa
"Všeobecná ambulancia pre dospelých, Selice, (MUDr. Ján Ziman)",https://www.e-vuc.sk/nsk/zdravotnictvo/ambulantne-zdravotnicke-zariadenia/sala/vseobecna-ambulancia-pre-dospelych-selice-mudr.-jan-ziman.html?page_id=88854, Všeobecné lekárstvo,Nitriansky,Šaľa
"Všeobecná ambulancia pre deti a dorast, Trnovec nad Váhom, (MUDr. Henrieta Vargová)",https://www.e-vuc.sk/nsk/zdravotnictvo/ambulantne-zdravotnicke-zariadenia/sala/vseobecna-ambulancia-pre-deti-a-dorast-trnovec-nad-vahom-mudr.-henrieta-vargova.html?page_id=88822, Všeobecná starostlivosť o deti a dorast,Nitriansky,Šaľa
"Všeobecná ambulancia pre deti a dorast, Selice, (MUDr. Henrieta Vargová)",https://www.e-vuc.sk/nsk/zdravotnictvo/ambulantne-zdravotnicke-zariadenia/sala/vseobecna-ambulancia-pre-deti-a-dorast-selice-mudr.-henrieta-vargova.html?page_id=88821, Všeobecná starostlivosť o deti a dorast,Nitriansky,Šaľa
"Ambulancia zubného lekárstva, Šaľa, (MUDr. Zoltán Tóth)",https://www.e-vuc.sk/nsk/zdravotnictvo/ambulantne-zdravotnicke-zariadenia/sala/ambulancia-zubneho-lekarstva-sala-mudr.-zoltan-toth.html?page_id=88804," Zubné lekárstvo, Dentoalveolárna chirurgia",Nitriansky,Šaľa
"Všeobecná ambulancia pre deti a dorast, Tešedíkovo, (MUDr. Gabriel Tóth)",https://www.e-vuc.sk/nsk/zdravotnictvo/ambulantne-zdravotnicke-zariadenia/sala/vseobecna-ambulancia-pre-deti-a-dorast-tesedikovo-mudr.-gabriel-toth.html?page_id=88803, Všeobecná starostlivosť o deti a dorast,Nitriansky,Šaľa
"Ambulancia klinickej imunológie a alergológie, Šaľa, (MUDr. Zora Saková)",https://www.e-vuc.sk/nsk/zdravotnictvo/ambulantne-zdravotnicke-zariadenia/sala/ambulancia-klinickej-imunologie-a-alergologie-sala-mudr.-zora-sakova.html?page_id=88757, Klinická imunológia a alergológia,Nitriansky,Šaľa
"Všeobecná ambulancia pre deti a dorast, Močenok, (MUDr. Oľga Páleníková)",https://www.e-vuc.sk/nsk/zdravotnictvo/ambulantne-zdravotnicke-zariadenia/sala/vseobecna-ambulancia-pre-deti-a-dorast-mocenok-mudr.-olga-palenikova.html?page_id=88743, Všeobecná starostlivosť o deti a dorast,Nitriansky,Šaľa
"Všeobecná ambulancia pre dospelých, Vlčany, (MUDr. Peter Bakič s.r.o.)",https://www.e-vuc.sk/nsk/zdravotnictvo/ambulantne-zdravotnicke-zariadenia/sala/vseobecna-ambulancia-pre-dospelych-vlcany-mudr.-peter-bakic.html?page_id=88722, Všeobecné lekárstvo,Nitriansky,Šaľa
"Otorinolaryngologická ambulancia, Šaľa, (MUDr. Pavol Miček)",https://www.e-vuc.sk/nsk/zdravotnictvo/ambulantne-zdravotnicke-zariadenia/sala/otorinolaryngologicka-ambulancia-sala-mudr.-pavol-micek.html?page_id=88653, Otorinolaryngológia,Nitriansky,Šaľa
"Všeobecná ambulancia pre dospelých, Šaľa, (MUDr. Elena Majorová)",https://www.e-vuc.sk/nsk/zdravotnictvo/ambulantne-zdravotnicke-zariadenia/sala/vseobecna-ambulancia-pre-dospelych-sala-mudr.-elena-majorova.html?page_id=88612, Všeobecné lekárstvo,Nitriansky,Šaľa
"Všeobecná ambulancia pre dospelých, Diakovce, (MUDr. Peter Lachký)",https://www.e-vuc.sk/nsk/zdravotnictvo/ambulantne-zdravotnicke-zariadenia/sala/vseobecna-ambulancia-pre-dospelych-diakovce-mudr.-peter-lachky.html?page_id=88582, Všeobecné lekárstvo,Nitriansky,Šaľa
"Všeobecná ambulancia pre dospelých, Šaľa, (MUDr. Margaréta Kuklovská)",https://www.e-vuc.sk/nsk/zdravotnictvo/ambulantne-zdravotnicke-zariadenia/sala/vseobecna-ambulancia-pre-dospelych-sala-mudr.-margareta-kuklovska.html?page_id=88565,!,Nitriansky,Šaľa
"Ambulancia zubného lekárstva, Šaľa, (MUDr. Ľudovít Kopáčik)",https://www.e-vuc.sk/nsk/zdravotnictvo/ambulantne-zdravotnicke-zariadenia/sala/ambulancia-zubneho-lekarstva-sala-mudr.-ludovit-kopacik.html?page_id=88542, Zubné lekárstvo,Nitriansky,Šaľa
"Všeobecná ambulancia pre dospelých, Šaľa, (MUDr. Ladislav Kaprinay)",https://www.e-vuc.sk/nsk/zdravotnictvo/ambulantne-zdravotnicke-zariadenia/sala/vseobecna-ambulancia-pre-dospelych-sala-mudr.-ladislav-kaprinay.html?page_id=88498, Všeobecné lekárstvo,Nitriansky,Šaľa
"Všeobecná ambulancia pre dospelých, Žihárec, (MUDr. Ladislav Kaprinay)",https://www.e-vuc.sk/nsk/zdravotnictvo/ambulantne-zdravotnicke-zariadenia/sala/vseobecna-ambulancia-pre-dospelych-ziharec-mudr.-ladislav-kaprinay.html?page_id=88499, Všeobecné lekárstvo,Nitriansky,Šaľa
"Ambulancia pediatrickej neurológie, Šaľa, (MUDr. Iveta Fölösová)",https://www.e-vuc.sk/nsk/zdravotnictvo/ambulantne-zdravotnicke-zariadenia/sala/ambulancia-pediatrickej-neurologie-sala-mudr.-iveta-folosova.html?page_id=88401,!,Nitriansky,Šaľa
"Ambulancia zubného lekárstva, Šaľa, (MUDr. Ladislav Czakó)",https://www.e-vuc.sk/nsk/zdravotnictvo/ambulantne-zdravotnicke-zariadenia/sala/ambulancia-zubneho-lekarstva-sala-mudr.-ladislav-czako.html?page_id=88353, Zubné lekárstvo,Nitriansky,Šaľa
"Ambulancia zubného lekárstva, Tešedíkovo, (MUDr. Danuška Czaková)",https://www.e-vuc.sk/nsk/zdravotnictvo/ambulantne-zdravotnicke-zariadenia/sala/ambulancia-zubneho-lekarstva-tesedikovo-mudr.-danuska-czakova.html?page_id=88352, Zubné lekárstvo,Nitriansky,Šaľa
"Všeobecná ambulancia pre dospelých, Močenok, (MUDr. Anton Karlubík, s.r.o.)",https://www.e-vuc.sk/nsk/zdravotnictvo/ambulantne-zdravotnicke-zariadenia/sala/vseobecna-ambulancia-pre-dospelych-mocenok-mudr.-anton-karlubik.html?page_id=88295, Všeobecné lekárstvo,Nitriansky,Šaľa
"Ambulancia zubného lekárstva, Šaľa, (MILEASTOM, s.r.o.)",https://www.e-vuc.sk/nsk/zdravotnictvo/ambulantne-zdravotnicke-zariadenia/sala/ambulancia-zubneho-lekarstva-sala-mileastom.html?page_id=88257, Zubné lekárstvo,Nitriansky,Šaľa
"Ambulancia klinickej psychológie, Šaľa, (Mgr. Renáta Bekőová)",https://www.e-vuc.sk/nsk/zdravotnictvo/ambulantne-zdravotnicke-zariadenia/sala/ambulancia-klinickej-psychologie-sala-mgr.-renata-bekoova.html?page_id=88229," Klinická psychológia, Dopravná psychológia",Nitriansky,Šaľa
"Otorinolaryngologická ambulancia, MUDr. Zita Vargová, Šaľa, (MedLand, s.r.o.)",https://www.e-vuc.sk/nsk/zdravotnictvo/ambulantne-zdravotnicke-zariadenia/sala/otorinolaryngologicka-ambulancia-mudr.-zita-vargova-sala-medland.html?page_id=88158, Otorinolaryngológia,Nitriansky,Šaľa
"Ambulancia zubného lekárstva, Trnovec nad Váhom, (MEDIMAX, s.r.o.)",https://www.e-vuc.sk/nsk/zdravotnictvo/ambulantne-zdravotnicke-zariadenia/sala/ambulancia-zubneho-lekarstva-trnovec-nad-vahom-medimax.html?page_id=88126, Zubné lekárstvo,Nitriansky,Šaľa
"Ambulancia zubného lekárstva, Šaľa, (MEDIMAX, s.r.o.)",https://www.e-vuc.sk/nsk/zdravotnictvo/ambulantne-zdravotnicke-zariadenia/sala/ambulancia-zubneho-lekarstva-sala-medimax.html?page_id=88125, Zubné lekárstvo,Nitriansky,Šaľa
"Všeobecná ambulancia pre deti a dorast, MUDr Kissová Eva, Neded, (MEDIKISS, s.r.o.)",https://www.e-vuc.sk/nsk/zdravotnictvo/ambulantne-zdravotnicke-zariadenia/sala/vseobecna-ambulancia-pre-deti-a-dorast-mudr-kissova-eva-neded-medikiss.html?page_id=88117, Všeobecná starostlivosť o deti a dorast,Nitriansky,Šaľa
"Všeobecná ambulancia pre dospelých, Šaľa, (MEDIK centrum Šaľa, s.r.o.)",https://www.e-vuc.sk/nsk/zdravotnictvo/ambulantne-zdravotnicke-zariadenia/sala/vseobecna-ambulancia-pre-dospelych-sala-medik-centrum-sala.html?page_id=88116, Všeobecné lekárstvo,Nitriansky,Šaľa
"Ambulancia vnútorného lekárstva, Šaľa, (MEDIDAN, s.r.o.)",https://www.e-vuc.sk/nsk/zdravotnictvo/ambulantne-zdravotnicke-zariadenia/sala/ambulancia-vnutorneho-lekarstva-sala-medidan.html?page_id=88105, Vnútorné lekárstvo,Nitriansky,Šaľa
