title,doctor_url,specialization,kraj,okres
"Pediatrická ambulancia, Kežmarok, (Nemocnica Dr.Vojtecha Alexandra v Kežmarku n.o.)",https://www.e-vuc.sk/psk/zdravotnictvo/ambulantne-zdravotnicke-zariadenia/kezmarok/pediatricka-ambulancia-kezmarok-nemocnica-dr.vojtecha-alexandra-v-kezmarku-n.o.-3.html?page_id=143299, Neonatológia,Prešovský,Kežmarok
"Ambulancia vnútorného lekárstva, Kežmarok, (Nemocnica Dr.Vojtecha Alexandra v Kežmarku n.o.)",https://www.e-vuc.sk/psk/zdravotnictvo/ambulantne-zdravotnicke-zariadenia/kezmarok/ambulancia-vnutorneho-lekarstva-kezmarok-nemocnica-dr.vojtecha-alexandra-v-kezmarku-n.o.-2.html?page_id=143297, Vnútorné lekárstvo,Prešovský,Kežmarok
"Pediatrická ambulancia, Kežmarok, (Nemocnica Dr.Vojtecha Alexandra v Kežmarku n.o.)",https://www.e-vuc.sk/psk/zdravotnictvo/ambulantne-zdravotnicke-zariadenia/kezmarok/pediatricka-ambulancia-kezmarok-nemocnica-dr.vojtecha-alexandra-v-kezmarku-n.o.-2.html?page_id=143298, Pediatria,Prešovský,Kežmarok
"Neurologická ambulancia IV., Spišská Stará Ves, (Ľubovnianska nemocnica, n. o.)",https://www.e-vuc.sk/psk/zdravotnictvo/ambulantne-zdravotnicke-zariadenia/kezmarok/neurologicka-ambulancia-iv.-spisska-stara-ves-lubovnianska-nemocnica-n.-o..html?page_id=142620, Neurológia,Prešovský,Kežmarok
"Ambulancia vnútorného lekárstva III., Spišská Stará Ves, (Ľubovnianska nemocnica, n. o.)",https://www.e-vuc.sk/psk/zdravotnictvo/ambulantne-zdravotnicke-zariadenia/kezmarok/ambulancia-vnutorneho-lekarstva-iii.-spisska-stara-ves-lubovnianska-nemocnica-n.-o..html?page_id=142619, Vnútorné lekárstvo,Prešovský,Kežmarok
"SVaLZ, fyziatria, balneológia a liečebná rehabilitácia, Kežmarok, (Nemocnica Dr.Vojtecha Alexandra v Kežmarku n.o.)",https://www.e-vuc.sk/psk/zdravotnictvo/ambulantne-zdravotnicke-zariadenia/kezmarok/svalz-fyziatria-balneologia-a-liecebna-rehabilitacia-kezmarok-nemocnica-dr.vojtecha-alexandra-v-kezmarku-n.o..html?page_id=142472," Fyziatria, balneológia a liečebná rehabilitácia",Prešovský,Kežmarok
"Ambulancia fyziatrie, balneológie a liečebnej rehabilitácie, Kežmarok, (Nemocnica Dr.Vojtecha Alexandra v Kežmarku n.o.)",https://www.e-vuc.sk/psk/zdravotnictvo/ambulantne-zdravotnicke-zariadenia/kezmarok/ambulancia-fyziatrie-balneologie-a-liecebnej-rehabilitacie-kezmarok-nemocnica-dr.vojtecha-alexandra-v-kezmarku-n.o.-1.html?page_id=142466," Fyziatria, balneológia a liečebná rehabilitácia",Prešovský,Kežmarok
"Ambulancia fyziatrie, balneológie a liečebnej rehabilitácie, Kežmarok, (Nemocnica Dr.Vojtecha Alexandra v Kežmarku n.o.)",https://www.e-vuc.sk/psk/zdravotnictvo/ambulantne-zdravotnicke-zariadenia/kezmarok/ambulancia-fyziatrie-balneologie-a-liecebnej-rehabilitacie-kezmarok-nemocnica-dr.vojtecha-alexandra-v-kezmarku-n.o..html?page_id=142465," Fyziatria, balneológia a liečebná rehabilitácia",Prešovský,Kežmarok
"Ortopedická ambulancia, Kežmarok, (PP-ORTO, s. r. o.)",https://www.e-vuc.sk/psk/zdravotnictvo/ambulantne-zdravotnicke-zariadenia/kezmarok/ortopedicka-ambulancia-kezmarok-pp-orto-s.-r.-o..html?page_id=142163, Ortopédia,Prešovský,Kežmarok
"Psychiatrická ambulancia, Kežmarok, (MUDr. Anna Uhrová)",https://www.e-vuc.sk/psk/zdravotnictvo/ambulantne-zdravotnicke-zariadenia/kezmarok/psychiatricka-ambulancia-kezmarok-mudr.-anna-uhrova.html?page_id=141977, Psychiatria,Prešovský,Kežmarok
"SVaLZ, fyzioterapia, Kežmarok, (Mgr. Václav Zubaj)",https://www.e-vuc.sk/psk/zdravotnictvo/ambulantne-zdravotnicke-zariadenia/kezmarok/svalz-fyzioterapia-kezmarok-mgr.-vaclav-zubaj.html?page_id=141975, Fyzioterapia,Prešovský,Kežmarok
"Všeobecná ambulancia pre dospelých, Lendak, (MUDr. Ján Krzysik, s. r. o.)",https://www.e-vuc.sk/psk/zdravotnictvo/ambulantne-zdravotnicke-zariadenia/kezmarok/vseobecna-ambulancia-pre-dospelych-lendak-mudr.-jan-krzysik-s.-r.-o..html?page_id=141964, Všeobecné lekárstvo,Prešovský,Kežmarok
"Psychiatrická ambulancia, Kežmarok, (PSYCH - Health s. r. o.)",https://www.e-vuc.sk/psk/zdravotnictvo/ambulantne-zdravotnicke-zariadenia/kezmarok/psychiatricka-ambulancia-kezmarok-psych-health-s.-r.-o..html?page_id=135769, Psychiatria,Prešovský,Kežmarok
"Jednodňová zdravotná starostlivosť, gastroenterológia, Kežmarok, (Nemocnica Dr.Vojtecha Alexandra v Kežmarku n.o.)",https://www.e-vuc.sk/psk/zdravotnictvo/ambulantne-zdravotnicke-zariadenia/kezmarok/jednodnova-zdravotna-starostlivost-gastroenterologia-kezmarok-nemocnica-dr.vojtecha-alexandra-v-kezmarku-n.o..html?page_id=135664, Gastroenterológia,Prešovský,Kežmarok
"Gastroenterologická ambulancia, Kežmarok, (Nemocnica Dr.Vojtecha Alexandra v Kežmarku n.o.)",https://www.e-vuc.sk/psk/zdravotnictvo/ambulantne-zdravotnicke-zariadenia/kezmarok/gastroenterologicka-ambulancia-kezmarok-nemocnica-dr.vojtecha-alexandra-v-kezmarku-n.o..html?page_id=135663, Gastroenterológia,Prešovský,Kežmarok
"Všeobecná ambulancia pre dospelých, Vrbov, (MEDSIL s. r. o.)",https://www.e-vuc.sk/psk/zdravotnictvo/ambulantne-zdravotnicke-zariadenia/kezmarok/vseobecna-ambulancia-pre-dospelych-vrbov-medsil-s.-r.-o..html?page_id=133168, Všeobecné lekárstvo,Prešovský,Kežmarok
"Všeobecná ambulancia pre dospelých, Kežmarok, (Anevita  s.r.o.)",https://www.e-vuc.sk/psk/zdravotnictvo/ambulantne-zdravotnicke-zariadenia/kezmarok/vseobecna-ambulancia-pre-dospelych-kezmarok-anevita.html?page_id=132815, Všeobecné lekárstvo,Prešovský,Kežmarok
"Ambulancia rýchlej zdravotnej pomoci, Spišská Stará Ves, (LSE - Life Star Emergency, s.r.o.)",https://www.e-vuc.sk/psk/zdravotnictvo/ambulantne-zdravotnicke-zariadenia/kezmarok/ambulancia-rychlej-zdravotnej-pomoci-spisska-stara-ves-lse-life-star-emergency.html?page_id=132629, Rýchla zdravotná pomoc,Prešovský,Kežmarok
"Ambulancia rýchlej zdravotnej pomoci, Spišská Belá, (LSE - Life Star Emergency, s.r.o.)",https://www.e-vuc.sk/psk/zdravotnictvo/ambulantne-zdravotnicke-zariadenia/kezmarok/ambulancia-rychlej-zdravotnej-pomoci-spisska-bela-lse-life-star-emergency.html?page_id=132630, Rýchla zdravotná pomoc,Prešovský,Kežmarok
"Ambulancia rýchlej lekárskej pomoci, Kežmarok, (LSE - Life Star Emergency, s.r.o.)",https://www.e-vuc.sk/psk/zdravotnictvo/ambulantne-zdravotnicke-zariadenia/kezmarok/ambulancia-rychlej-lekarskej-pomoci-kezmarok-lse-life-star-emergency.html?page_id=132632, Rýchla lekárska pomoc,Prešovský,Kežmarok
"Dispečing dopravnej zdravotnej služby, Kežmarok, (AGEL Clinic s. r. o.)",https://www.e-vuc.sk/psk/zdravotnictvo/ambulantne-zdravotnicke-zariadenia/kezmarok/dispecing-dopravnej-zdravotnej-sluzby-kezmarok-agel-clinic-s.-r.-o..html?page_id=132572,,Prešovský,Kežmarok
"B. Braun Avitum s.r.o., Spišská Stará Ves, (B. Braun Avitum, s.r.o.)",https://www.e-vuc.sk/psk/zdravotnictvo/ambulantne-zdravotnicke-zariadenia/kezmarok/b.-braun-avitum-spisska-stara-ves-b.-braun-avitum.html?page_id=131086, Nefrológia,Prešovský,Kežmarok
"Všeobecná ambulancia pre dospelých, Spišská Belá, (SIMEDI s.r.o.)",https://www.e-vuc.sk/psk/zdravotnictvo/ambulantne-zdravotnicke-zariadenia/kezmarok/vseobecna-ambulancia-pre-dospelych-spisska-bela-simedi.html?page_id=130823, Všeobecné lekárstvo,Prešovský,Kežmarok
"Ambulancia zubného lekárstva, Spišská Belá, (DENTALIVE,s.r.o.)",https://www.e-vuc.sk/psk/zdravotnictvo/ambulantne-zdravotnicke-zariadenia/kezmarok/ambulancia-zubneho-lekarstva-spisska-bela-dentalive.html?page_id=130758, Zubné lekárstvo,Prešovský,Kežmarok
"Ambulancia zubného lekárstva, Kežmarok, (Paudent, s.r.o.)",https://www.e-vuc.sk/psk/zdravotnictvo/ambulantne-zdravotnicke-zariadenia/kezmarok/ambulancia-zubneho-lekarstva-kezmarok-paudent.html?page_id=129693, Zubné lekárstvo,Prešovský,Kežmarok
"Ambulancia zubného lekárstva, Kežmarok, (ZUBČEKOVO, s.r.o.)",https://www.e-vuc.sk/psk/zdravotnictvo/ambulantne-zdravotnicke-zariadenia/kezmarok/ambulancia-zubneho-lekarstva-kezmarok-zubcekovo.html?page_id=129638, Zubné lekárstvo,Prešovský,Kežmarok
"SVaLZ, hematológia a transfuziológia, Kežmarok, (Nemocnica AGEL Levoča a.s.)",https://www.e-vuc.sk/psk/zdravotnictvo/ambulantne-zdravotnicke-zariadenia/kezmarok/svalz-hematologia-a-transfuziologia-kezmarok-nemocnica-agel-levoca-a.s..html?page_id=129572, Hematológia a transfuziológia,Prešovský,Kežmarok
"SVaLZ, klinická biochémia, Kežmarok, (Nemocnica AGEL Levoča a.s.)",https://www.e-vuc.sk/psk/zdravotnictvo/ambulantne-zdravotnicke-zariadenia/kezmarok/svalz-klinicka-biochemia-kezmarok-nemocnica-agel-levoca-a.s..html?page_id=129571, Klinická biochémia,Prešovský,Kežmarok
"Ambulancia zubného lekárstva, Lendak, (Dentema s.r.o.)",https://www.e-vuc.sk/psk/zdravotnictvo/ambulantne-zdravotnicke-zariadenia/kezmarok/ambulancia-zubneho-lekarstva-lendak-dentema.html?page_id=127593, Zubné lekárstvo,Prešovský,Kežmarok
"B. Braun Avitum s.r.o., Kežmarok, (B. Braun Avitum, s.r.o.)",https://www.e-vuc.sk/psk/zdravotnictvo/ambulantne-zdravotnicke-zariadenia/kezmarok/b.-braun-avitum-kezmarok-b.-braun-avitum-1.html?page_id=126149, Nefrológia,Prešovský,Kežmarok
"B. Braun Avitum s.r.o., Kežmarok, (B. Braun Avitum, s.r.o.)",https://www.e-vuc.sk/psk/zdravotnictvo/ambulantne-zdravotnicke-zariadenia/kezmarok/b.-braun-avitum-kezmarok-b.-braun-avitum.html?page_id=126148, Nefrológia,Prešovský,Kežmarok
"Ambulancia zubného lekárstva, MDDr. Oleksandra Rohach, Kežmarok, (Dens KK, s. r. o.)",https://www.e-vuc.sk/psk/zdravotnictvo/ambulantne-zdravotnicke-zariadenia/kezmarok/ambulancia-zubneho-lekarstva-mddr.-oleksandra-rohach-kezmarok-dens-kk-s.-r.-o..html?page_id=125723, Zubné lekárstvo,Prešovský,Kežmarok
"Mobilný hospic, Kežmarok, (Spišská katolícka charita)",https://www.e-vuc.sk/psk/zdravotnictvo/ambulantne-zdravotnicke-zariadenia/kezmarok/mobilny-hospic-kezmarok-spisska-katolicka-charita.html?page_id=125686, Domáca hospicová starostlivosť,Prešovský,Kežmarok
"Ambulancia klinickej psychológie, Kežmarok, (ProPeople consulting, s.r.o.)",https://www.e-vuc.sk/psk/zdravotnictvo/ambulantne-zdravotnicke-zariadenia/kezmarok/ambulancia-klinickej-psychologie-kezmarok-propeople-consulting.html?page_id=124109," Klinická psychológia, Dopravná psychológia",Prešovský,Kežmarok
"Ambulancia zubného lekárstva, Kežmarok, (SMART SMILE s.r.o.)",https://www.e-vuc.sk/psk/zdravotnictvo/ambulantne-zdravotnicke-zariadenia/kezmarok/ambulancia-zubneho-lekarstva-kezmarok-smart-smile.html?page_id=124085, Zubné lekárstvo,Prešovský,Kežmarok
"Otorinolaryngologická ambulancia, Spišská Stará Ves, (PULMEDIS s.r.o.)",https://www.e-vuc.sk/psk/zdravotnictvo/ambulantne-zdravotnicke-zariadenia/kezmarok/otorinolaryngologicka-ambulancia-spisska-stara-ves-pulmedis.html?page_id=123028, Otorinolaryngológia,Prešovský,Kežmarok
"Všeobecná ambulancia pre deti a dorast, Podhorany, (MILKOVÁ - PEDIATRIA, s.r.o.,)",https://www.e-vuc.sk/psk/zdravotnictvo/ambulantne-zdravotnicke-zariadenia/kezmarok/vseobecna-ambulancia-pre-deti-a-dorast-podhorany-milkova-pediatria.html?page_id=122376, Všeobecná starostlivosť o deti a dorast,Prešovský,Kežmarok
"Všeobecná ambulancia pre deti a dorast, Holumnica, (MILKOVÁ - PEDIATRIA, s.r.o.,)",https://www.e-vuc.sk/psk/zdravotnictvo/ambulantne-zdravotnicke-zariadenia/kezmarok/vseobecna-ambulancia-pre-deti-a-dorast-holumnica-milkova-pediatria.html?page_id=122375, Všeobecná starostlivosť o deti a dorast,Prešovský,Kežmarok
"Neurologická ambulancia, Kežmarok, (MUDr. Eva Kurucová, s.r.o.,)",https://www.e-vuc.sk/psk/zdravotnictvo/ambulantne-zdravotnicke-zariadenia/kezmarok/neurologicka-ambulancia-kezmarok-mudr.-eva-kurucova.html?page_id=122319, Neurológia,Prešovský,Kežmarok
"Ambulancia zubného lekárstva, Slovenská Ves, (MUDr. Cyril Václav)",https://www.e-vuc.sk/psk/zdravotnictvo/ambulantne-zdravotnicke-zariadenia/kezmarok/ambulancia-zubneho-lekarstva-slovenska-ves-mudr.-cyril-vaclav.html?page_id=122178, Zubné lekárstvo,Prešovský,Kežmarok
"Dermatovenerologická ambulancia, Kežmarok, (MUDr. Gabriela Hudzíková)",https://www.e-vuc.sk/psk/zdravotnictvo/ambulantne-zdravotnicke-zariadenia/kezmarok/dermatovenerologicka-ambulancia-kezmarok-mudr.-gabriela-hudzikova.html?page_id=121077, Dermatovenerológia,Prešovský,Kežmarok
"SVaLZ, rádiológia, Kežmarok, (Nemocnica Dr.Vojtecha Alexandra v Kežmarku n.o.)",https://www.e-vuc.sk/psk/zdravotnictvo/ambulantne-zdravotnicke-zariadenia/kezmarok/svalz-radiologia-kezmarok-nemocnica-dr.vojtecha-alexandra-v-kezmarku-n.o.-3.html?page_id=120786," Rádiológia, Počítačová tomografia - CT",Prešovský,Kežmarok
"SVaLZ, rádiológia, Kežmarok, (Nemocnica Dr.Vojtecha Alexandra v Kežmarku n.o.)",https://www.e-vuc.sk/psk/zdravotnictvo/ambulantne-zdravotnicke-zariadenia/kezmarok/svalz-radiologia-kezmarok-nemocnica-dr.vojtecha-alexandra-v-kezmarku-n.o.-2.html?page_id=120785," Rádiológia, Mamografia",Prešovský,Kežmarok
"SVaLZ, rádiológia, Kežmarok, (Nemocnica Dr.Vojtecha Alexandra v Kežmarku n.o.)",https://www.e-vuc.sk/psk/zdravotnictvo/ambulantne-zdravotnicke-zariadenia/kezmarok/svalz-radiologia-kezmarok-nemocnica-dr.vojtecha-alexandra-v-kezmarku-n.o.-1.html?page_id=120784," Rádiológia, Sonografia",Prešovský,Kežmarok
"SVaLZ, rádiológia, Kežmarok, (Nemocnica Dr.Vojtecha Alexandra v Kežmarku n.o.)",https://www.e-vuc.sk/psk/zdravotnictvo/ambulantne-zdravotnicke-zariadenia/kezmarok/svalz-radiologia-kezmarok-nemocnica-dr.vojtecha-alexandra-v-kezmarku-n.o..html?page_id=120783, Rádiológia,Prešovský,Kežmarok
"Jednodňová zdravotná starostlivosť, ortopédia, Kežmarok, (Nemocnica Dr.Vojtecha Alexandra v Kežmarku n.o.)",https://www.e-vuc.sk/psk/zdravotnictvo/ambulantne-zdravotnicke-zariadenia/kezmarok/jednodnova-zdravotna-starostlivost-ortopedia-kezmarok-nemocnica-dr.vojtecha-alexandra-v-kezmarku-n.o..html?page_id=120778, Ortopédia,Prešovský,Kežmarok
"Jednodňová zdravotná starostlivosť, úrazová chirurgia, Kežmarok, (Nemocnica Dr.Vojtecha Alexandra v Kežmarku n.o.)",https://www.e-vuc.sk/psk/zdravotnictvo/ambulantne-zdravotnicke-zariadenia/kezmarok/jednodnova-zdravotna-starostlivost-urazova-chirurgia-kezmarok-nemocnica-dr.vojtecha-alexandra-v-kezmarku-n.o..html?page_id=120777, úrazová chirurgia,Prešovský,Kežmarok
"Jednodňová zdravotná starostlivosť, chirurgia, Kežmarok, (Nemocnica Dr.Vojtecha Alexandra v Kežmarku n.o.)",https://www.e-vuc.sk/psk/zdravotnictvo/ambulantne-zdravotnicke-zariadenia/kezmarok/jednodnova-zdravotna-starostlivost-chirurgia-kezmarok-nemocnica-dr.vojtecha-alexandra-v-kezmarku-n.o..html?page_id=120776, Chirurgia,Prešovský,Kežmarok
"Jednodňová zdravotná starostlivosť, otorinolaryngológia, Kežmarok, (Nemocnica Dr.Vojtecha Alexandra v Kežmarku n.o.)",https://www.e-vuc.sk/psk/zdravotnictvo/ambulantne-zdravotnicke-zariadenia/kezmarok/jednodnova-zdravotna-starostlivost-otorinolaryngologia-kezmarok-nemocnica-dr.vojtecha-alexandra-v-kezmarku-n.o..html?page_id=120781, Otorinolaryngológia,Prešovský,Kežmarok
"Pediatrická ambulancia, Kežmarok, (Nemocnica Dr.Vojtecha Alexandra v Kežmarku n.o.)",https://www.e-vuc.sk/psk/zdravotnictvo/ambulantne-zdravotnicke-zariadenia/kezmarok/pediatricka-ambulancia-kezmarok-nemocnica-dr.vojtecha-alexandra-v-kezmarku-n.o..html?page_id=120770, Pediatria,Prešovský,Kežmarok
"Stacionár, vnútorné lekárstvo, Kežmarok, (Nemocnica Dr.Vojtecha Alexandra v Kežmarku n.o.)",https://www.e-vuc.sk/psk/zdravotnictvo/ambulantne-zdravotnicke-zariadenia/kezmarok/stacionar-vnutorne-lekarstvo-kezmarok-nemocnica-dr.vojtecha-alexandra-v-kezmarku-n.o..html?page_id=120772, Vnútorné lekárstvo,Prešovský,Kežmarok
"Pediatrická ambulancia, Kežmarok, (Nemocnica Dr.Vojtecha Alexandra v Kežmarku n.o.)",https://www.e-vuc.sk/psk/zdravotnictvo/ambulantne-zdravotnicke-zariadenia/kezmarok/pediatricka-ambulancia-kezmarok-nemocnica-dr.vojtecha-alexandra-v-kezmarku-n.o.-1.html?page_id=120771, Neonatológia,Prešovský,Kežmarok
"Jednodňová zdravotná starostlivosť, gynekológia a pôrodníctvo, Kežmarok, (Nemocnica Dr.Vojtecha Alexandra v Kežmarku n.o.)",https://www.e-vuc.sk/psk/zdravotnictvo/ambulantne-zdravotnicke-zariadenia/kezmarok/jednodnova-zdravotna-starostlivost-gynekologia-a-porodnictvo-kezmarok-nemocnica-dr.vojtecha-alexandra-v-kezmarku-n.o..html?page_id=120775, Gynekológia a pôrodníctvo,Prešovský,Kežmarok
"Všeobecná ambulancia pre dospelých, Kežmarok, (Nemocnica Dr.Vojtecha Alexandra v Kežmarku n.o.)",https://www.e-vuc.sk/psk/zdravotnictvo/ambulantne-zdravotnicke-zariadenia/kezmarok/vseobecna-ambulancia-pre-dospelych-kezmarok-nemocnica-dr.vojtecha-alexandra-v-kezmarku-n.o..html?page_id=120774, Všeobecné lekárstvo,Prešovský,Kežmarok
"Neurologická ambulancia, Kežmarok, (Nemocnica Dr.Vojtecha Alexandra v Kežmarku n.o.)",https://www.e-vuc.sk/psk/zdravotnictvo/ambulantne-zdravotnicke-zariadenia/kezmarok/neurologicka-ambulancia-kezmarok-nemocnica-dr.vojtecha-alexandra-v-kezmarku-n.o..html?page_id=120767, Neurológia,Prešovský,Kežmarok
"Kardiologická ambulancia, Kežmarok, (Nemocnica Dr.Vojtecha Alexandra v Kežmarku n.o.)",https://www.e-vuc.sk/psk/zdravotnictvo/ambulantne-zdravotnicke-zariadenia/kezmarok/kardiologicka-ambulancia-kezmarok-nemocnica-dr.vojtecha-alexandra-v-kezmarku-n.o..html?page_id=120766, Kardiológia,Prešovský,Kežmarok
"Gynekologická ambulancia, Kežmarok, (Nemocnica Dr.Vojtecha Alexandra v Kežmarku n.o.)",https://www.e-vuc.sk/psk/zdravotnictvo/ambulantne-zdravotnicke-zariadenia/kezmarok/gynekologicka-ambulancia-kezmarok-nemocnica-dr.vojtecha-alexandra-v-kezmarku-n.o.-2.html?page_id=120764, Gynekológia a pôrodníctvo,Prešovský,Kežmarok
"Gynekologická ambulancia, Kežmarok, (Nemocnica Dr.Vojtecha Alexandra v Kežmarku n.o.)",https://www.e-vuc.sk/psk/zdravotnictvo/ambulantne-zdravotnicke-zariadenia/kezmarok/gynekologicka-ambulancia-kezmarok-nemocnica-dr.vojtecha-alexandra-v-kezmarku-n.o.-3.html?page_id=120765,!,Prešovský,Kežmarok
"Otorinolaryngologická ambulancia, Kežmarok, (Nemocnica Dr.Vojtecha Alexandra v Kežmarku n.o.)",https://www.e-vuc.sk/psk/zdravotnictvo/ambulantne-zdravotnicke-zariadenia/kezmarok/otorinolaryngologicka-ambulancia-kezmarok-nemocnica-dr.vojtecha-alexandra-v-kezmarku-n.o..html?page_id=120769,!,Prešovský,Kežmarok
"Gynekologická ambulancia, Kežmarok, (Nemocnica Dr.Vojtecha Alexandra v Kežmarku n.o.)",https://www.e-vuc.sk/psk/zdravotnictvo/ambulantne-zdravotnicke-zariadenia/kezmarok/gynekologicka-ambulancia-kezmarok-nemocnica-dr.vojtecha-alexandra-v-kezmarku-n.o..html?page_id=120762, Gynekológia a pôrodníctvo,Prešovský,Kežmarok
"Geriatrická ambulancia, Kežmarok, (Nemocnica Dr.Vojtecha Alexandra v Kežmarku n.o.)",https://www.e-vuc.sk/psk/zdravotnictvo/ambulantne-zdravotnicke-zariadenia/kezmarok/geriatricka-ambulancia-kezmarok-nemocnica-dr.vojtecha-alexandra-v-kezmarku-n.o..html?page_id=120759, Geriatria,Prešovský,Kežmarok
"Gynekologická ambulancia, Kežmarok, (Nemocnica Dr.Vojtecha Alexandra v Kežmarku n.o.)",https://www.e-vuc.sk/psk/zdravotnictvo/ambulantne-zdravotnicke-zariadenia/kezmarok/gynekologicka-ambulancia-kezmarok-nemocnica-dr.vojtecha-alexandra-v-kezmarku-n.o.-1.html?page_id=120763, Gynekológia a pôrodníctvo,Prešovský,Kežmarok
"Chirurgická ambulancia, Kežmarok, (Nemocnica Dr.Vojtecha Alexandra v Kežmarku n.o.)",https://www.e-vuc.sk/psk/zdravotnictvo/ambulantne-zdravotnicke-zariadenia/kezmarok/chirurgicka-ambulancia-kezmarok-nemocnica-dr.vojtecha-alexandra-v-kezmarku-n.o..html?page_id=120755,!,Prešovský,Kežmarok
"Chirurgická ambulancia, Kežmarok, (Nemocnica Dr.Vojtecha Alexandra v Kežmarku n.o.)",https://www.e-vuc.sk/psk/zdravotnictvo/ambulantne-zdravotnicke-zariadenia/kezmarok/chirurgicka-ambulancia-kezmarok-nemocnica-dr.vojtecha-alexandra-v-kezmarku-n.o.-1.html?page_id=120756, Chirurgia,Prešovský,Kežmarok
"Ambulancia úrazovej chirurgie, Kežmarok, (Nemocnica Dr.Vojtecha Alexandra v Kežmarku n.o.)",https://www.e-vuc.sk/psk/zdravotnictvo/ambulantne-zdravotnicke-zariadenia/kezmarok/ambulancia-urazovej-chirurgie-kezmarok-nemocnica-dr.vojtecha-alexandra-v-kezmarku-n.o..html?page_id=120754, úrazová chirurgia,Prešovský,Kežmarok
"Ambulancia vnútorného lekárstva, Spišská Stará Ves, (Nemocnica Dr.Vojtecha Alexandra v Kežmarku n.o.)",https://www.e-vuc.sk/psk/zdravotnictvo/ambulantne-zdravotnicke-zariadenia/kezmarok/ambulancia-vnutorneho-lekarstva-spisska-stara-ves-nemocnica-dr.vojtecha-alexandra-v-kezmarku-n.o..html?page_id=120752,!,Prešovský,Kežmarok
"Ambulancia pediatrickej nefrológie, Kežmarok, (Nemocnica Dr.Vojtecha Alexandra v Kežmarku n.o.)",https://www.e-vuc.sk/psk/zdravotnictvo/ambulantne-zdravotnicke-zariadenia/kezmarok/ambulancia-pediatrickej-nefrologie-kezmarok-nemocnica-dr.vojtecha-alexandra-v-kezmarku-n.o..html?page_id=120749,!,Prešovský,Kežmarok
"Ambulancia pediatrickej gastroenterológie, hepatológie a výživy, Kežmarok, (Nemocnica Dr.Vojtecha Alexandra v Kežmarku n.o.)",https://www.e-vuc.sk/psk/zdravotnictvo/ambulantne-zdravotnicke-zariadenia/kezmarok/ambulancia-pediatrickej-gastroenterologie-hepatologie-a-vyzivy-kezmarok-nemocnica-dr.vojtecha-alexandra-v-kezmarku-n.o..html?page_id=120748," Pediatrická gastroenterológia, hepatológia a výživa",Prešovský,Kežmarok
"Ambulancia vnútorného lekárstva, Kežmarok, (Nemocnica Dr.Vojtecha Alexandra v Kežmarku n.o.)",https://www.e-vuc.sk/psk/zdravotnictvo/ambulantne-zdravotnicke-zariadenia/kezmarok/ambulancia-vnutorneho-lekarstva-kezmarok-nemocnica-dr.vojtecha-alexandra-v-kezmarku-n.o.-1.html?page_id=120753, Vnútorné lekárstvo,Prešovský,Kežmarok
"Ambulancia pediatrickej neurológie, Kežmarok, (Nemocnica Dr.Vojtecha Alexandra v Kežmarku n.o.)",https://www.e-vuc.sk/psk/zdravotnictvo/ambulantne-zdravotnicke-zariadenia/kezmarok/ambulancia-pediatrickej-neurologie-kezmarok-nemocnica-dr.vojtecha-alexandra-v-kezmarku-n.o..html?page_id=120750, Pediatrická neurológia,Prešovský,Kežmarok
"Ambulancia vnútorného lekárstva, Kežmarok, (Nemocnica Dr.Vojtecha Alexandra v Kežmarku n.o.)",https://www.e-vuc.sk/psk/zdravotnictvo/ambulantne-zdravotnicke-zariadenia/kezmarok/ambulancia-vnutorneho-lekarstva-kezmarok-nemocnica-dr.vojtecha-alexandra-v-kezmarku-n.o..html?page_id=120751, Vnútorné lekárstvo,Prešovský,Kežmarok
"Ambulancia klinickej logopédie, Kežmarok, (Nemocnica Dr.Vojtecha Alexandra v Kežmarku n.o.)",https://www.e-vuc.sk/psk/zdravotnictvo/ambulantne-zdravotnicke-zariadenia/kezmarok/ambulancia-klinickej-logopedie-kezmarok-nemocnica-dr.vojtecha-alexandra-v-kezmarku-n.o..html?page_id=120746, Klinická logopédia,Prešovský,Kežmarok
"Ambulancia anestéziológie a intenzívnej medicíny, Kežmarok, (Nemocnica Dr.Vojtecha Alexandra v Kežmarku n.o.)",https://www.e-vuc.sk/psk/zdravotnictvo/ambulantne-zdravotnicke-zariadenia/kezmarok/ambulancia-anesteziologie-a-intenzivnej-mediciny-kezmarok-nemocnica-dr.vojtecha-alexandra-v-kezmarku-n.o..html?page_id=120745, Anestéziológia a intenzívna medicína,Prešovský,Kežmarok
"Ortopedická ambulancia, Kežmarok, (Nemocnica Poprad, a.s.)",https://www.e-vuc.sk/psk/zdravotnictvo/ambulantne-zdravotnicke-zariadenia/kezmarok/ortopedicka-ambulancia-kezmarok-nemocnica-poprad-a.s..html?page_id=120723, Ortopédia,Prešovský,Kežmarok
"Všeobecná ambulancia pre dospelých, Slovenská Ves, (Maďar Med, s.r.o.)",https://www.e-vuc.sk/psk/zdravotnictvo/ambulantne-zdravotnicke-zariadenia/kezmarok/vseobecna-ambulancia-pre-dospelych-slovenska-ves-madar-med.html?page_id=120255, Všeobecné lekárstvo,Prešovský,Kežmarok
"ADOS, Tvarožnianska, Kežmarok, (Spišská katolícka charita)",https://www.e-vuc.sk/psk/zdravotnictvo/ambulantne-zdravotnicke-zariadenia/kezmarok/ados-tvaroznianska-kezmarok-spisska-katolicka-charita.html?page_id=105189, Domáca ošetrovateľská starostlivosť,Prešovský,Kežmarok
"Mobilný hospic, Spišská Stará Ves, (Spišská katolícka charita)",https://www.e-vuc.sk/psk/zdravotnictvo/ambulantne-zdravotnicke-zariadenia/kezmarok/mobilny-hospic-spisska-stara-ves-spisska-katolicka-charita.html?page_id=105075, Domáca hospicová starostlivosť,Prešovský,Kežmarok
"Všeobecná ambulancia pre dospelých, Toporec, (MedKan s.r.o.)",https://www.e-vuc.sk/psk/zdravotnictvo/ambulantne-zdravotnicke-zariadenia/kezmarok/vseobecna-ambulancia-pre-dospelych-toporec-medkan.html?page_id=104976, Všeobecné lekárstvo,Prešovský,Kežmarok
"SVaLZ, rádiológia, Kežmarok, (GYNETA, s.r.o.)",https://www.e-vuc.sk/psk/zdravotnictvo/ambulantne-zdravotnicke-zariadenia/kezmarok/svalz-radiologia-kezmarok-gyneta.html?page_id=104927, Rádiológia,Prešovský,Kežmarok
"ADOS, Štúrova, Spišská Stará Ves, (Spišská katolícka charita)",https://www.e-vuc.sk/psk/zdravotnictvo/ambulantne-zdravotnicke-zariadenia/kezmarok/ados-sturova-spisska-stara-ves-spisska-katolicka-charita.html?page_id=104373, Domáca ošetrovateľská starostlivosť,Prešovský,Kežmarok
"SVaLZ, hematológia a transfuziológia, Kežmarok, (Unilabs Slovensko, s. r. o.)",https://www.e-vuc.sk/psk/zdravotnictvo/ambulantne-zdravotnicke-zariadenia/kezmarok/svalz-hematologia-a-transfuziologia-kezmarok-unilabs-slovensko-s.-r.-o..html?page_id=100938, Hematológia a transfuziológia,Prešovský,Kežmarok
"SVaLZ, klinická biochémia, Kežmarok, (Unilabs Slovensko, s. r. o.)",https://www.e-vuc.sk/psk/zdravotnictvo/ambulantne-zdravotnicke-zariadenia/kezmarok/svalz-klinicka-biochemia-kezmarok-unilabs-slovensko-s.-r.-o..html?page_id=100934, Klinická biochémia,Prešovský,Kežmarok
"Hematologická a transfúziologická ambulancia, Kežmarok, (Unilabs Slovensko, s. r. o.)",https://www.e-vuc.sk/psk/zdravotnictvo/ambulantne-zdravotnicke-zariadenia/kezmarok/hematologicka-a-transfuziologicka-ambulancia-kezmarok-unilabs-slovensko-s.-r.-o..html?page_id=100929, Hematológia a transfuziológia,Prešovský,Kežmarok
