title,doctor_url,specialization,kraj,okres
"Otorinolaryngologická ambulancia, Snina, (ORL-M.S., s. r. o.)",https://www.e-vuc.sk/psk/zdravotnictvo/ambulantne-zdravotnicke-zariadenia/snina/otorinolaryngologicka-ambulancia-snina-orl-m.s.-s.-r.-o..html?page_id=143357, Otorinolaryngológia,Prešovský,Snina
"Otorinolaryngologická ambulancia, Snina, (ORL-M.S., s. r. o.)",https://www.e-vuc.sk/psk/zdravotnictvo/ambulantne-zdravotnicke-zariadenia/snina/otorinolaryngologicka-ambulancia-snina-orl-m.s.-s.-r.-o.-1.html?page_id=143358, Foniatria,Prešovský,Snina
"Všeobecná ambulancia pre dospelých, Stakčín, (Stakmed s. r. o.)",https://www.e-vuc.sk/psk/zdravotnictvo/ambulantne-zdravotnicke-zariadenia/snina/vseobecna-ambulancia-pre-dospelych-stakcin-stakmed-s.-r.-o..html?page_id=142074, Všeobecné lekárstvo,Prešovský,Snina
"Všeobecná ambulancia pre dospelých, Ubľa, (MUDr. Alina Piteľ)",https://www.e-vuc.sk/psk/zdravotnictvo/ambulantne-zdravotnicke-zariadenia/snina/vseobecna-ambulancia-pre-dospelych-ubla-mudr.-alina-pitel.html?page_id=142070, Všeobecné lekárstvo,Prešovský,Snina
"Všeobecná ambulancia pre deti a dorast, Snina, (MEDIRAG, s.r.o.)",https://www.e-vuc.sk/psk/zdravotnictvo/ambulantne-zdravotnicke-zariadenia/snina/vseobecna-ambulancia-pre-deti-a-dorast-snina-medirag-1.html?page_id=141294, Pediatria,Prešovský,Snina
"Kardiologická ambulancia, Snina, (Nemocnica Snina, s.r.o.)",https://www.e-vuc.sk/psk/zdravotnictvo/ambulantne-zdravotnicke-zariadenia/snina/kardiologicka-ambulancia-snina-nemocnica-snina.html?page_id=140794, Kardiológia,Prešovský,Snina
"Neurologická ambulancia, Snina, (VITAL PLUS, s.r.o.)",https://www.e-vuc.sk/psk/zdravotnictvo/ambulantne-zdravotnicke-zariadenia/snina/neurologicka-ambulancia-snina-vital-plus.html?page_id=140759, Neurológia,Prešovský,Snina
"Stacionár, neurológia, Snina, (VITAL PLUS, s.r.o.)",https://www.e-vuc.sk/psk/zdravotnictvo/ambulantne-zdravotnicke-zariadenia/snina/stacionar-neurologia-snina-vital-plus.html?page_id=140760, Neurológia,Prešovský,Snina
"Všeobecná ambulancia pre deti a dorast, Belá nad Cirochou, (EMaPED s. r. o.)",https://www.e-vuc.sk/psk/zdravotnictvo/ambulantne-zdravotnicke-zariadenia/snina/vseobecna-ambulancia-pre-deti-a-dorast-bela-nad-cirochou-emaped-s.-r.-o..html?page_id=135666, Všeobecná starostlivosť o deti a dorast,Prešovský,Snina
"Ambulancia rýchlej zdravotnej pomoci, Ulič, (LSE - Life Star Emergency, s.r.o.)",https://www.e-vuc.sk/psk/zdravotnictvo/ambulantne-zdravotnicke-zariadenia/snina/ambulancia-rychlej-zdravotnej-pomoci-ulic-lse-life-star-emergency.html?page_id=135181, Rýchla zdravotná pomoc,Prešovský,Snina
"Ambulancia vnútorného lekárstva, Snina, (Badamed s. r. o.)",https://www.e-vuc.sk/psk/zdravotnictvo/ambulantne-zdravotnicke-zariadenia/snina/ambulancia-vnutorneho-lekarstva-snina-badamed-s.-r.-o..html?page_id=135163," Vnútorné lekárstvo, Abdominálna ultrasonografia u dospelých, Diagnostická a intervenčná ezofagogastroduodenoskopia, Diagnostická a intervenčná kolonoskopia",Prešovský,Snina
"Ambulancia rýchlej zdravotnej pomoci, Ubľa, (LSE - Life Star Emergency, s.r.o.)",https://www.e-vuc.sk/psk/zdravotnictvo/ambulantne-zdravotnicke-zariadenia/snina/ambulancia-rychlej-zdravotnej-pomoci-ubla-lse-life-star-emergency.html?page_id=134934, Rýchla zdravotná pomoc,Prešovský,Snina
"Ambulancia rýchlej zdravotnej pomoci, Snina 2, (LSE - Life Star Emergency, s.r.o.)",https://www.e-vuc.sk/psk/zdravotnictvo/ambulantne-zdravotnicke-zariadenia/snina/ambulancia-rychlej-zdravotnej-pomoci-snina-2-lse-life-star-emergency.html?page_id=134935, Rýchla zdravotná pomoc,Prešovský,Snina
"Všeobecná ambulancia pre deti a dorast, Snina, (EMaPED s. r. o.)",https://www.e-vuc.sk/psk/zdravotnictvo/ambulantne-zdravotnicke-zariadenia/snina/vseobecna-ambulancia-pre-deti-a-dorast-snina-emaped-s.-r.-o..html?page_id=134862, Všeobecná starostlivosť o deti a dorast,Prešovský,Snina
"Gynekologická ambulancia, Snina, (GYNOPED PLUS s. r. o.)",https://www.e-vuc.sk/psk/zdravotnictvo/ambulantne-zdravotnicke-zariadenia/snina/gynekologicka-ambulancia-snina-gynoped-plus-s.-r.-o..html?page_id=133166, Gynekológia a pôrodníctvo,Prešovský,Snina
"Ambulancia rýchlej lekárskej pomoci, Snina 1, (LSE - Life Star Emergency, s.r.o.)",https://www.e-vuc.sk/psk/zdravotnictvo/ambulantne-zdravotnicke-zariadenia/snina/ambulancia-rychlej-lekarskej-pomoci-snina-1-lse-life-star-emergency.html?page_id=133082, Rýchla lekárska pomoc,Prešovský,Snina
"Hematologická a transfúziologická ambulancia, MUDr. Viera Coraničová, Snina, (Nemocnica Snina, s.r.o.)",https://www.e-vuc.sk/psk/zdravotnictvo/ambulantne-zdravotnicke-zariadenia/snina/hematologicka-a-transfuziologicka-ambulancia-mudr.-viera-coranicova-snina-nemocnica-snina.html?page_id=132983, Hematológia a transfuziológia,Prešovský,Snina
"Dispečing dopravnej zdravotnej služby, Snina, (Wiener SAN, s.r.o.)",https://www.e-vuc.sk/psk/zdravotnictvo/ambulantne-zdravotnicke-zariadenia/snina/dispecing-dopravnej-zdravotnej-sluzby-snina-wiener-san.html?page_id=132635,,Prešovský,Snina
"Jednodňová zdravotná starostlivosť, urológia, Snina, (MEDOMEX, s.r.o.)",https://www.e-vuc.sk/psk/zdravotnictvo/ambulantne-zdravotnicke-zariadenia/snina/jednodnova-zdravotna-starostlivost-urologia-snina-medomex.html?page_id=132363, Urológia,Prešovský,Snina
"Urologická ambulancia, Snina, (MEDOMEX, s.r.o.)",https://www.e-vuc.sk/psk/zdravotnictvo/ambulantne-zdravotnicke-zariadenia/snina/urologicka-ambulancia-snina-medomex.html?page_id=132362, Urológia,Prešovský,Snina
"Všeobecná ambulancia pre dospelých, Snina, (PRO SAN-MR s.r.o.)",https://www.e-vuc.sk/psk/zdravotnictvo/ambulantne-zdravotnicke-zariadenia/snina/vseobecna-ambulancia-pre-dospelych-snina-pro-san-mr.html?page_id=132279, Všeobecné lekárstvo,Prešovský,Snina
"Všeobecná ambulancia pre dospelých, Ulič, (PRO SAN-MR s.r.o.)",https://www.e-vuc.sk/psk/zdravotnictvo/ambulantne-zdravotnicke-zariadenia/snina/vseobecna-ambulancia-pre-dospelych-ulic-pro-san-mr.html?page_id=132280, Všeobecné lekárstvo,Prešovský,Snina
"SVaLZ, ultrazvuk v gynekológii a pôrodníctve, Snina, (MEDOMEX, s.r.o.)",https://www.e-vuc.sk/psk/zdravotnictvo/ambulantne-zdravotnicke-zariadenia/snina/svalz-ultrazvuk-v-gynekologii-a-porodnictve-snina-medomex.html?page_id=131520, Ultrazvuk v gynekológii a pôrodníctve,Prešovský,Snina
"Psychiatrická ambulancia, Snina, (NORTHIA s.r.o.)",https://www.e-vuc.sk/psk/zdravotnictvo/ambulantne-zdravotnicke-zariadenia/snina/psychiatricka-ambulancia-snina-northia.html?page_id=130222, Psychiatria,Prešovský,Snina
"Ambulancia zubného lekárstva, Belá nad Cirochou, (MUDr. Pavol Brečka)",https://www.e-vuc.sk/psk/zdravotnictvo/ambulantne-zdravotnicke-zariadenia/snina/ambulancia-zubneho-lekarstva-bela-nad-cirochou-mudr.-pavol-brecka.html?page_id=130050, Zubné lekárstvo,Prešovský,Snina
"Ambulancia čeľustnej ortopédie, Belá nad Cirochou, (MUDr. Pavol Brečka)",https://www.e-vuc.sk/psk/zdravotnictvo/ambulantne-zdravotnicke-zariadenia/snina/ambulancia-celustnej-ortopedie-bela-nad-cirochou-mudr.-pavol-brecka.html?page_id=130051, čeľustná ortopédia,Prešovský,Snina
"Všeobecná ambulancia pre deti a dorast, Stakčín, (HAJAPED, s.r.o.)",https://www.e-vuc.sk/psk/zdravotnictvo/ambulantne-zdravotnicke-zariadenia/snina/vseobecna-ambulancia-pre-deti-a-dorast-stakcin-hajaped.html?page_id=129727, Pediatria,Prešovský,Snina
"Všeobecná ambulancia pre deti a dorast, Ubľa, (HAJAPED, s.r.o.)",https://www.e-vuc.sk/psk/zdravotnictvo/ambulantne-zdravotnicke-zariadenia/snina/vseobecna-ambulancia-pre-deti-a-dorast-ubla-hajaped.html?page_id=129728, Pediatria,Prešovský,Snina
"ADOS, Pálenčiarska, Snina, (ADOS MAJA s.r.o.)",https://www.e-vuc.sk/psk/zdravotnictvo/ambulantne-zdravotnicke-zariadenia/snina/ados-palenciarska-snina-ados-maja.html?page_id=129633, Domáca ošetrovateľská starostlivosť,Prešovský,Snina
"SVaLZ, klinická imunológia a alergológia, RNDr. Jana Giričová, Snina, (Nemocnica Snina, s.r.o.)",https://www.e-vuc.sk/psk/zdravotnictvo/ambulantne-zdravotnicke-zariadenia/snina/svalz-klinicka-imunologia-a-alergologia-rndr.-jana-giricova-snina-nemocnica-snina.html?page_id=125779, Klinická imunológia a alergológia,Prešovský,Snina
"Všeobecná ambulancia pre dospelých, Snina, (VAPO Medical s.r.o.)",https://www.e-vuc.sk/psk/zdravotnictvo/ambulantne-zdravotnicke-zariadenia/snina/vseobecna-ambulancia-pre-dospelych-snina-vapo-medical.html?page_id=124351, Všeobecné lekárstvo,Prešovský,Snina
"Ambulancia zubného lekárstva, Snina, (SURADENT, s.r.o.)",https://www.e-vuc.sk/psk/zdravotnictvo/ambulantne-zdravotnicke-zariadenia/snina/ambulancia-zubneho-lekarstva-snina-suradent.html?page_id=124111, Zubné lekárstvo,Prešovský,Snina
"Všeobecná ambulancia pre dospelých, Belá nad Cirochou, (MUDr. Valerián Hajduk)",https://www.e-vuc.sk/psk/zdravotnictvo/ambulantne-zdravotnicke-zariadenia/snina/vseobecna-ambulancia-pre-dospelych-bela-nad-cirochou-mudr.-valerian-hajduk.html?page_id=122357, Všeobecné lekárstvo,Prešovský,Snina
"Ambulancia zubného lekárstva, Snina, (MUDr. Katarína Molnárová)",https://www.e-vuc.sk/psk/zdravotnictvo/ambulantne-zdravotnicke-zariadenia/snina/ambulancia-zubneho-lekarstva-snina-mudr.-katarina-molnarova.html?page_id=122355, Zubné lekárstvo,Prešovský,Snina
"MDDr. Monika Chvostaľová, Ambulancia zubného lekárstva, Snina, (ApolloniaDental, s.r.o.)",https://www.e-vuc.sk/psk/zdravotnictvo/ambulantne-zdravotnicke-zariadenia/snina/mddr.-monika-chvostalova-ambulancia-zubneho-lekarstva-snina-apolloniadental.html?page_id=122341, Zubné lekárstvo,Prešovský,Snina
"Ambulancia čeľustnej ortopédie, Snina, (VARGDENT s.r.o.,)",https://www.e-vuc.sk/psk/zdravotnictvo/ambulantne-zdravotnicke-zariadenia/snina/ambulancia-celustnej-ortopedie-snina-vargdent.html?page_id=122294, čeľustná ortopédia,Prešovský,Snina
"Ambulancia zubného lekárstva, Snina, (VARGDENT s.r.o.,)",https://www.e-vuc.sk/psk/zdravotnictvo/ambulantne-zdravotnicke-zariadenia/snina/ambulancia-zubneho-lekarstva-snina-vargdent.html?page_id=122293, Zubné lekárstvo,Prešovský,Snina
"Ambulancia zubného lekárstva, Snina, (VARGDENT s.r.o.,)",https://www.e-vuc.sk/psk/zdravotnictvo/ambulantne-zdravotnicke-zariadenia/snina/ambulancia-zubneho-lekarstva-snina-vargdent-1.html?page_id=122292," Zubné lekárstvo, Stomatológia, čeľustná ortopédia",Prešovský,Snina
"Všeobecná ambulancia pre deti a dorast, Snina, (MUDr. Mária Čornaničová)",https://www.e-vuc.sk/psk/zdravotnictvo/ambulantne-zdravotnicke-zariadenia/snina/vseobecna-ambulancia-pre-deti-a-dorast-snina-mudr.-maria-cornanicova.html?page_id=122282, Všeobecná starostlivosť o deti a dorast,Prešovský,Snina
"Ambulancia zubného lekárstva, Snina, (MUDr. Marcel Kunec)",https://www.e-vuc.sk/psk/zdravotnictvo/ambulantne-zdravotnicke-zariadenia/snina/ambulancia-zubneho-lekarstva-snina-mudr.-marcel-kunec.html?page_id=122280, Zubné lekárstvo,Prešovský,Snina
"Všeobecná ambulancia pre dospelých, Snina, (MEDICALIS, s.r.o.)",https://www.e-vuc.sk/psk/zdravotnictvo/ambulantne-zdravotnicke-zariadenia/snina/vseobecna-ambulancia-pre-dospelych-snina-medicalis.html?page_id=122263, Všeobecné lekárstvo,Prešovský,Snina
"Všeobecná ambulancia pre deti a dorast, Snina, (A.M. MEDICALIS, s.r.o.)",https://www.e-vuc.sk/psk/zdravotnictvo/ambulantne-zdravotnicke-zariadenia/snina/vseobecna-ambulancia-pre-deti-a-dorast-snina-a.m.-medicalis.html?page_id=122243, Všeobecná starostlivosť o deti a dorast,Prešovský,Snina
"Všeobecná ambulancia pre dospelých, Juraj Dušak, Snina, (MEDICID SV s.r.o.)",https://www.e-vuc.sk/psk/zdravotnictvo/ambulantne-zdravotnicke-zariadenia/snina/vseobecna-ambulancia-pre-dospelych-juraj-dusak-snina-medicid-sv.html?page_id=119916, Všeobecné lekárstvo,Prešovský,Snina
"Gynekologická ambulancia, Snina, (PEDIGYN s.r.o.)",https://www.e-vuc.sk/psk/zdravotnictvo/ambulantne-zdravotnicke-zariadenia/snina/gynekologicka-ambulancia-snina-pedigyn.html?page_id=104881, Gynekológia a pôrodníctvo,Prešovský,Snina
"ADOS, Komenského, Snina, (Gréckokatolícka charita Prešov)",https://www.e-vuc.sk/psk/zdravotnictvo/ambulantne-zdravotnicke-zariadenia/snina/ados-komenskeho-snina-greckokatolicka-charita-presov.html?page_id=104872, Domáca ošetrovateľská starostlivosť,Prešovský,Snina
"Endokrinologická ambulancia, Snina, (MEDICIN s.r.o.)",https://www.e-vuc.sk/psk/zdravotnictvo/ambulantne-zdravotnicke-zariadenia/snina/endokrinologicka-ambulancia-snina-medicin.html?page_id=103427, Endokrinológia,Prešovský,Snina
"Ambulancia vnútorného lekárstva, Snina, (MEDICIN s.r.o.)",https://www.e-vuc.sk/psk/zdravotnictvo/ambulantne-zdravotnicke-zariadenia/snina/ambulancia-vnutorneho-lekarstva-snina-medicin.html?page_id=103426, Vnútorné lekárstvo,Prešovský,Snina
"Ambulancia zubného lekárstva, Snina, (MP dent Snina s.r.o.)",https://www.e-vuc.sk/psk/zdravotnictvo/ambulantne-zdravotnicke-zariadenia/snina/ambulancia-zubneho-lekarstva-snina-mp-dent-snina.html?page_id=103374, Zubné lekárstvo,Prešovský,Snina
"Všeobecná ambulancia pre deti a dorast, Ulič, (Nemocnica Snina, s.r.o.)",https://www.e-vuc.sk/psk/zdravotnictvo/ambulantne-zdravotnicke-zariadenia/snina/vseobecna-ambulancia-pre-deti-a-dorast-ulic-nemocnica-snina.html?page_id=100890, Všeobecná starostlivosť o deti a dorast,Prešovský,Snina
"SVaLZ, funkčná diagnostika, Snina, (Nemocnica Snina, s.r.o.)",https://www.e-vuc.sk/psk/zdravotnictvo/ambulantne-zdravotnicke-zariadenia/snina/svalz-funkcna-diagnostika-snina-nemocnica-snina.html?page_id=100759, Funkčná diagnostika,Prešovský,Snina
"SVaLZ, centrálna sterilizácia, Snina, (Nemocnica Snina, s.r.o.)",https://www.e-vuc.sk/psk/zdravotnictvo/ambulantne-zdravotnicke-zariadenia/snina/svalz-centralna-sterilizacia-snina-nemocnica-snina.html?page_id=100758, Centrálna sterilizácia,Prešovský,Snina
"SVaLZ, hematológia a transfuziológia, Snina, (Nemocnica Snina, s.r.o.)",https://www.e-vuc.sk/psk/zdravotnictvo/ambulantne-zdravotnicke-zariadenia/snina/svalz-hematologia-a-transfuziologia-snina-nemocnica-snina.html?page_id=100757, Hematológia a transfuziológia,Prešovský,Snina
"SVaLZ, fyziatria, balneológia a liečebná rehabilitácia, MUDr. Natália Kyjovská, Snina, (Nemocnica Snina, s.r.o.)",https://www.e-vuc.sk/psk/zdravotnictvo/ambulantne-zdravotnicke-zariadenia/snina/svalz-fyziatria-balneologia-a-liecebna-rehabilitacia-mudr.-natalia-kyjovska-snina-nemocnica-snina.html?page_id=100756," Fyziatria, balneológia a liečebná rehabilitácia",Prešovský,Snina
"SVaLZ, klinická biochémia, MUDr. Viera Coraničová, Snina, (Nemocnica Snina, s.r.o.)",https://www.e-vuc.sk/psk/zdravotnictvo/ambulantne-zdravotnicke-zariadenia/snina/svalz-klinicka-biochemia-mudr.-viera-coranicova-snina-nemocnica-snina.html?page_id=100755, Klinická biochémia,Prešovský,Snina
"SVaLZ, počítačová tomografia - CT, MUDr. Monika Lukačínová, Snina, (Nemocnica Snina, s.r.o.)",https://www.e-vuc.sk/psk/zdravotnictvo/ambulantne-zdravotnicke-zariadenia/snina/svalz-pocitacova-tomografia-ct-mudr.-monika-lukacinova-snina-nemocnica-snina.html?page_id=100754," Počítačová tomografia - CT, Rádiológia",Prešovský,Snina
"Jednodňová zdravotná starostlivosť, chirurgia, Snina, (Nemocnica Snina, s.r.o.)",https://www.e-vuc.sk/psk/zdravotnictvo/ambulantne-zdravotnicke-zariadenia/snina/jednodnova-zdravotna-starostlivost-chirurgia-snina-nemocnica-snina.html?page_id=100753, Chirurgia,Prešovský,Snina
"Jednodňová zdravotná starostlivosť, gynekológia a pôrodníctvo, MUDr. František Pavlovčin , Snina, (Nemocnica Snina, s.r.o.)",https://www.e-vuc.sk/psk/zdravotnictvo/ambulantne-zdravotnicke-zariadenia/snina/jednodnova-zdravotna-starostlivost-gynekologia-a-porodnictvo-mudr.-frantisek-pavlovcin-snina-nemocnica-snina.html?page_id=100752, Gynekológia a pôrodníctvo,Prešovský,Snina
"Stacionár, neurológia, Snina, (Nemocnica Snina, s.r.o.)",https://www.e-vuc.sk/psk/zdravotnictvo/ambulantne-zdravotnicke-zariadenia/snina/stacionar-neurologia-snina-nemocnica-snina.html?page_id=100751," Neurológia, Funkčná diagnostika",Prešovský,Snina
"Stacionár, vnútorné lekárstvo, Snina, (Nemocnica Snina, s.r.o.)",https://www.e-vuc.sk/psk/zdravotnictvo/ambulantne-zdravotnicke-zariadenia/snina/stacionar-vnutorne-lekarstvo-snina-nemocnica-snina.html?page_id=100750," Vnútorné lekárstvo, Funkčná diagnostika",Prešovský,Snina
"Neurologická ambulancia, Snina, (Nemocnica Snina, s.r.o.)",https://www.e-vuc.sk/psk/zdravotnictvo/ambulantne-zdravotnicke-zariadenia/snina/neurologicka-ambulancia-snina-nemocnica-snina.html?page_id=100749, Neurológia,Prešovský,Snina
"Gynekologická ambulancia, Snina, (Nemocnica Snina, s.r.o.)",https://www.e-vuc.sk/psk/zdravotnictvo/ambulantne-zdravotnicke-zariadenia/snina/gynekologicka-ambulancia-snina-nemocnica-snina.html?page_id=100748, Gynekológia a pôrodníctvo,Prešovský,Snina
"Gastroenterologická ambulancia, Snina, (Nemocnica Snina, s.r.o.)",https://www.e-vuc.sk/psk/zdravotnictvo/ambulantne-zdravotnicke-zariadenia/snina/gastroenterologicka-ambulancia-snina-nemocnica-snina.html?page_id=100747, Gastroenterológia,Prešovský,Snina
"Chirurgická ambulancia, Snina, (Nemocnica Snina, s.r.o.)",https://www.e-vuc.sk/psk/zdravotnictvo/ambulantne-zdravotnicke-zariadenia/snina/chirurgicka-ambulancia-snina-nemocnica-snina.html?page_id=100746, Chirurgia,Prešovský,Snina
"Ambulancia úrazovej chirurgie, Snina, (Nemocnica Snina, s.r.o.)",https://www.e-vuc.sk/psk/zdravotnictvo/ambulantne-zdravotnicke-zariadenia/snina/ambulancia-urazovej-chirurgie-snina-nemocnica-snina.html?page_id=100745, úrazová chirurgia,Prešovský,Snina
"Ambulancia vnútorného lekárstva, Snina, (Nemocnica Snina, s.r.o.)",https://www.e-vuc.sk/psk/zdravotnictvo/ambulantne-zdravotnicke-zariadenia/snina/ambulancia-vnutorneho-lekarstva-snina-nemocnica-snina.html?page_id=100744, Vnútorné lekárstvo,Prešovský,Snina
"Ambulancia fyziatrie, balneológie a liečebnej rehabilitácie, MUDr. Natália Kyjovská, Snina, (Nemocnica Snina, s.r.o.)",https://www.e-vuc.sk/psk/zdravotnictvo/ambulantne-zdravotnicke-zariadenia/snina/ambulancia-fyziatrie-balneologie-a-liecebnej-rehabilitacie-mudr.-natalia-kyjovska-snina-nemocnica-snina.html?page_id=100743," Fyziatria, balneológia a liečebná rehabilitácia",Prešovský,Snina
"Ambulancia diabetológie a porúch látkovej premeny a výživy, MUDr. Lenka Lajtarová, Snina, (Nemocnica Snina, s.r.o.)",https://www.e-vuc.sk/psk/zdravotnictvo/ambulantne-zdravotnicke-zariadenia/snina/ambulancia-diabetologie-a-poruch-latkovej-premeny-a-vyzivy-mudr.-lenka-lajtarova-snina-nemocnica-snina.html?page_id=100742," Diabetológia, poruchy látkovej premeny a výživy",Prešovský,Snina
"Algeziologická ambulancia, Snina, (Nemocnica Snina, s.r.o.)",https://www.e-vuc.sk/psk/zdravotnictvo/ambulantne-zdravotnicke-zariadenia/snina/algeziologicka-ambulancia-snina-nemocnica-snina.html?page_id=100741, Algeziológia,Prešovský,Snina
"SVaLZ, fyziatria, balneológia a liečebná rehabilitácia, Snina, (ZDRAVTIP s.r.o.)",https://www.e-vuc.sk/psk/zdravotnictvo/ambulantne-zdravotnicke-zariadenia/snina/svalz-fyziatria-balneologia-a-liecebna-rehabilitacia-snina-zdravtip.html?page_id=100518," Fyziatria, balneológia a liečebná rehabilitácia",Prešovský,Snina
"Ambulancia fyziatrie, balneológie a liečebnej rehabilitácie, Snina, (ZDRAVTIP s.r.o.)",https://www.e-vuc.sk/psk/zdravotnictvo/ambulantne-zdravotnicke-zariadenia/snina/ambulancia-fyziatrie-balneologie-a-liecebnej-rehabilitacie-snina-zdravtip-1.html?page_id=100517, Akupunktúra,Prešovský,Snina
"Ambulancia fyziatrie, balneológie a liečebnej rehabilitácie, Snina, (ZDRAVTIP s.r.o.)",https://www.e-vuc.sk/psk/zdravotnictvo/ambulantne-zdravotnicke-zariadenia/snina/ambulancia-fyziatrie-balneologie-a-liecebnej-rehabilitacie-snina-zdravtip.html?page_id=100516," Fyziatria, balneológia a liečebná rehabilitácia",Prešovský,Snina
"Stacionár, chirurgia, Snina, (VIRTUS SNINA, s.r.o.)",https://www.e-vuc.sk/psk/zdravotnictvo/ambulantne-zdravotnicke-zariadenia/snina/stacionar-chirurgia-snina-virtus-snina.html?page_id=100364, Chirurgia,Prešovský,Snina
"Stacionár, vnútorné lekárstvo, Snina, (VIRTUS SNINA, s.r.o.)",https://www.e-vuc.sk/psk/zdravotnictvo/ambulantne-zdravotnicke-zariadenia/snina/stacionar-vnutorne-lekarstvo-snina-virtus-snina.html?page_id=100363, Vnútorné lekárstvo,Prešovský,Snina
"Chirurgická ambulancia, Snina, (VIRTUS SNINA, s.r.o.)",https://www.e-vuc.sk/psk/zdravotnictvo/ambulantne-zdravotnicke-zariadenia/snina/chirurgicka-ambulancia-snina-virtus-snina.html?page_id=100362, Chirurgia,Prešovský,Snina
"Ambulancia vnútorného lekárstva, Snina, (VIRTUS SNINA, s.r.o.)",https://www.e-vuc.sk/psk/zdravotnictvo/ambulantne-zdravotnicke-zariadenia/snina/ambulancia-vnutorneho-lekarstva-snina-virtus-snina.html?page_id=100361, Vnútorné lekárstvo,Prešovský,Snina
"SVaLZ, funkčná diagnostika, Snina, (VIRTUS SNINA, s.r.o.)",https://www.e-vuc.sk/psk/zdravotnictvo/ambulantne-zdravotnicke-zariadenia/snina/svalz-funkcna-diagnostika-snina-virtus-snina.html?page_id=100360, Funkčná diagnostika,Prešovský,Snina
"Ambulancia zubného lekárstva, Snina, (VALUDENT, s.r.o.)",https://www.e-vuc.sk/psk/zdravotnictvo/ambulantne-zdravotnicke-zariadenia/snina/ambulancia-zubneho-lekarstva-snina-valudent.html?page_id=100335, Zubné lekárstvo,Prešovský,Snina
"Všeobecná ambulancia pre dospelých, Snina, (SILHOM, s.r.o.)",https://www.e-vuc.sk/psk/zdravotnictvo/ambulantne-zdravotnicke-zariadenia/snina/vseobecna-ambulancia-pre-dospelych-snina-silhom.html?page_id=100081, Všeobecné lekárstvo,Prešovský,Snina
"Všeobecná ambulancia pre dospelých, Snina, (SILHOM, s.r.o.)",https://www.e-vuc.sk/psk/zdravotnictvo/ambulantne-zdravotnicke-zariadenia/snina/vseobecna-ambulancia-pre-dospelych-snina-silhom-1.html?page_id=100080,!,Prešovský,Snina
"Všeobecná ambulancia pre dospelých, Snina, (SILHOM, s.r.o.)",https://www.e-vuc.sk/psk/zdravotnictvo/ambulantne-zdravotnicke-zariadenia/snina/vseobecna-ambulancia-pre-dospelych-snina-silhom-2.html?page_id=100079, Všeobecné lekárstvo,Prešovský,Snina
"Chirurgická ambulancia, Snina, (REMARI, s.r.o.)",https://www.e-vuc.sk/psk/zdravotnictvo/ambulantne-zdravotnicke-zariadenia/snina/chirurgicka-ambulancia-snina-remari.html?page_id=99975, Chirurgia,Prešovský,Snina
"Gynekologická ambulancia, Snina, (PEDIGYN s.r.o.)",https://www.e-vuc.sk/psk/zdravotnictvo/ambulantne-zdravotnicke-zariadenia/snina/gynekologicka-ambulancia-snina-pedigyn-1.html?page_id=99758," Gynekológia a pôrodníctvo, Ultrazvuk v gynekológii a pôrodníctve",Prešovský,Snina
"Všeobecná ambulancia pre deti a dorast, Snina, (PEDIATRIA-ART s.r.o.)",https://www.e-vuc.sk/psk/zdravotnictvo/ambulantne-zdravotnicke-zariadenia/snina/vseobecna-ambulancia-pre-deti-a-dorast-snina-pediatria-art.html?page_id=99748, Všeobecná starostlivosť o deti a dorast,Prešovský,Snina
"Ambulancia zubného lekárstva, Ubľa, (PARODENT, s.r.o.)",https://www.e-vuc.sk/psk/zdravotnictvo/ambulantne-zdravotnicke-zariadenia/snina/ambulancia-zubneho-lekarstva-ubla-parodent.html?page_id=99698, Zubné lekárstvo,Prešovský,Snina
"Ortopedická ambulancia, Snina, (ORTMEDI s.r.o.)",https://www.e-vuc.sk/psk/zdravotnictvo/ambulantne-zdravotnicke-zariadenia/snina/ortopedicka-ambulancia-snina-ortmedi.html?page_id=99637, Ortopédia,Prešovský,Snina
"Otorinolaryngologická ambulancia, Snina, (ORL-ART, s.r.o.)",https://www.e-vuc.sk/psk/zdravotnictvo/ambulantne-zdravotnicke-zariadenia/snina/otorinolaryngologicka-ambulancia-snina-orl-art.html?page_id=99604, Otorinolaryngológia,Prešovský,Snina
"Oftalmologická ambulancia, Snina, (OPHTAL-ASTERMED s.r.o.)",https://www.e-vuc.sk/psk/zdravotnictvo/ambulantne-zdravotnicke-zariadenia/snina/oftalmologicka-ambulancia-snina-ophtal-astermed.html?page_id=99583, Oftalmológia,Prešovský,Snina
"Ambulancia zubného lekárstva, Snina, (ONIDENT, s.r.o.)",https://www.e-vuc.sk/psk/zdravotnictvo/ambulantne-zdravotnicke-zariadenia/snina/ambulancia-zubneho-lekarstva-snina-onident.html?page_id=99576, Zubné lekárstvo,Prešovský,Snina
"Ambulancia zubného lekárstva, Stakčín, (MUDr. Ľubomír Kelly)",https://www.e-vuc.sk/psk/zdravotnictvo/ambulantne-zdravotnicke-zariadenia/snina/ambulancia-zubneho-lekarstva-stakcin-mudr.-lubomir-kelly.html?page_id=99390, Zubné lekárstvo,Prešovský,Snina
"Ambulancia zubného lekárstva, Snina, (MUDr. Vlasatá, s.r.o.)",https://www.e-vuc.sk/psk/zdravotnictvo/ambulantne-zdravotnicke-zariadenia/snina/ambulancia-zubneho-lekarstva-snina-mudr.-vlasata.html?page_id=99355, Zubné lekárstvo,Prešovský,Snina
"Ambulancia zubného lekárstva, Snina, (MUDr. Oľga Bôžiková)",https://www.e-vuc.sk/psk/zdravotnictvo/ambulantne-zdravotnicke-zariadenia/snina/ambulancia-zubneho-lekarstva-snina-mudr.-olga-bozikova.html?page_id=99245, Zubné lekárstvo,Prešovský,Snina
"Všeobecná ambulancia pre dospelých, Snina, (MUDr. Nadežda Kunecová)",https://www.e-vuc.sk/psk/zdravotnictvo/ambulantne-zdravotnicke-zariadenia/snina/vseobecna-ambulancia-pre-dospelych-snina-mudr.-nadezda-kunecova.html?page_id=99224, Všeobecné lekárstvo,Prešovský,Snina
"Všeobecná ambulancia pre deti a dorast, Snina, (MUDr. Mária Kostelníková)",https://www.e-vuc.sk/psk/zdravotnictvo/ambulantne-zdravotnicke-zariadenia/snina/vseobecna-ambulancia-pre-deti-a-dorast-snina-mudr.-maria-kostelnikova.html?page_id=99165, Všeobecná starostlivosť o deti a dorast,Prešovský,Snina
"Ambulancia pediatrickej kardiológie, Snina, (MUDr. Mária Kostelníková)",https://www.e-vuc.sk/psk/zdravotnictvo/ambulantne-zdravotnicke-zariadenia/snina/ambulancia-pediatrickej-kardiologie-snina-mudr.-maria-kostelnikova.html?page_id=99164, Pediatrická kardiológia,Prešovský,Snina
